sample_id,content,label,has_url,has_phone_number,sender_type,category,obfuscation_level,data_origin,source_dataset,source_file,source_row_id
phase1_00656,"TK ViettelPay 9704...1278 GD +10,000 VND luc 2023-01-09 18:16:56 So du 14,000 VND Phi: -0 VND ND: 230109193128174 QUATANGVOUCHER 230109193128174 84867256447",0,0,1,brandname,Ngân hàng thật,NONE,real,real_label_0,data/ground_truth/dataset_label_0_with_categories.csv,655
phase1_00657,"Quy khach duoc cong them 8 diem Viettel++ boi giao dich Tieu dung vien thong thang 12/2022. Thoi han su dung diem den 31/01/2024. Hay truy cap https://myvt.page.link/vtplus tren My Viettel hoac *098# de doi diem sang Data, SMS, Phut goi cung nhieu uu dai gia tri khac. Chi tiet LH 198. Tran trong.",0,1,0,brandname,Khác,NONE,real,real_label_0,data/ground_truth/dataset_label_0_with_categories.csv,656
phase1_00658,"Quy khach duoc cong them 250 diem Viettel++ boi giao dich Tieu dung vien thong thang 12/2022. Thoi han su dung diem den 31/01/2024. Hay truy cap https://myvt.page.link/vtplus tren My Viettel hoac *098# de doi diem sang Data, SMS, Phut goi cung nhieu uu dai gia tri khac. Chi tiet LH 198. Tran trong.",0,1,0,brandname,Khác,NONE,real,real_label_0,data/ground_truth/dataset_label_0_with_categories.csv,657
phase1_00659,"[TB] Mừng xuân Quý Mão - giảm 50% giá gói V90C. Tham gia, soạn V90C gửi 191: 45K/30 ngày (giá gốc 90K) có 30GB (1GB/ngày), miễn phí gọi điện (chi tiết gói tại viettel.vn/s/V90C ); nhận thêm 9 lượt RUNG CÂY TRÚNG VÀNG tại viettel.vn/tet . Gói cước gia hạn sau 30 ngày với giá gốc. CT áp dụng với lần đăng ký đầu tiên đến hết ngày 7/1/2023, dành riêng cho Quý khách. Chi tiết LH 198 (0đ).",0,1,0,brandname,Viễn thông,NONE,real,real_label_0,data/ground_truth/dataset_label_0_with_categories.csv,658
phase1_00660,"[QC] TANG ngay modem wifi sieu toc, 2-4 thang cuoc TB khi dang ky moi DV Internet Cap quang Viettel va dong truoc cuoc 6-12 thang tai https://viettel.vn/s/ftth. Cuoc TB chi tu 220.000d/thang. Chi tiet LH 18008168 (0d). Tu choi QC, soan TC3 gui 199.",0,1,1,brandname,Quảng cáo hợp lệ,NONE,real,real_label_0,data/ground_truth/dataset_label_0_with_categories.csv,659
phase1_00661,Ch e ranh ghe qua c sưa cho chi it đô nua nha .Hm nay c lai co đô cho e sua r ne,0,0,0,personal_number,Cá nhân & OTP,NONE,real,real_label_0,data/ground_truth/dataset_label_0_with_categories.csv,660
phase1_00662,[TB] Nhận GẤP ĐÔI ưu đãi khi đổi điểm Viettel++ 1.000 điểm = 400MB Data (sử dụng trong ngày đổi). 1.000 điểm = 200 SMS nội mạng. 1.000 điểm = 20 phút nội mạng. Ưu đãi SMS/phút gọi sử dụng trong 30 ngày. CT áp dụng đến 07/01/2023. Nhanh tay truy cập https://myvt.page.link/doithoai để đổi ưu đãi. LH 198 (0đ). Trân trọng.,0,1,0,brandname,Khác,NONE,real,real_label_0,data/ground_truth/dataset_label_0_with_categories.csv,661
phase1_00663,"SD TK 1033311702 -10,000VND luc 04-01-2023 17:54:29. SD 182,015VND. Ref Ecom.EW23010453727494.MOMO.0867256447.CashIn.61a5b6a5484b",0,0,1,brandname,Ngân hàng thật,NONE,real,real_label_0,data/ground_truth/dataset_label_0_with_categories.csv,662
phase1_00664,"[TB] ĐÓN 2023 - GIẢM GIÁ 23K! Soạn 30N gửi 191: Chỉ còn 277K (giá gốc 300K) có 150GB (5GB/ngày), miễn phí gọi điện, SMS nội mạng, TV360. Gói cước gia hạn với giá gốc sau 30 ngày. Chi tiết gói 30N tại https://viettel.vn/s/30Na . CT áp dụng với lần đăng ký đầu tiên đến 5/1/2023 cho TB của Quý khách. LH 198 (0đ).",0,1,0,brandname,Viễn thông,NONE,real,real_label_0,data/ground_truth/dataset_label_0_with_categories.csv,663
phase1_00665,"[TB] CHÀO NĂM MỚI - GIẢM NGAY 23K khi mua gói V120Z. Soạn V120Z gửi 191 để tham gia: 67K/30 ngày (giá gốc 90K) có 120GB (4GB/ngày), miễn phí gọi điện (chi tiết gói tại www.myvt.vn/v120z ). Gói cước gia hạn sau 30 ngày với giá gốc. CT dành riêng cho Quý khách, áp dụng với lần đăng ký đầu tiên đến hết 05/01/2023. LH 198 (0đ).",0,1,0,brandname,Viễn thông,NONE,real,real_label_0,data/ground_truth/dataset_label_0_with_categories.csv,664
phase1_00666,"Moi Quy khach soan tin de tham gia DV ung Data: 1 gui 9598 de ung 3072MB (cuoc phi 23400d, su dung trong 7 ngay). 2 gui 9598 de ung 1024MB (cuoc phi 9144d, su dung trong vong 24h sau khi cong). Tin nhan co hieu luc trong 24h. Hoac truy cap http://s.viettel.vn/waput2 de tiep tuc duoc mien phi data 3G/4G xem bong da, truyen hinh, phim bom tan. Chi tiet LH 198 (0d)",0,1,0,shortcode,Viễn thông,NONE,real,real_label_0,data/ground_truth/dataset_label_0_with_categories.csv,665
phase1_00667,"Quý khách đã hủy khôi phục gói V120Z. Để biết thông tin các ưu đãi khác, bấm gọi *098#. Chi tiết LH 198 (0đ). Trân trọng.",0,0,0,shortcode,Viễn thông,NONE,real,real_label_0,data/ground_truth/dataset_label_0_with_categories.csv,666
phase1_00668,"Quý khách đang có yêu cầu hủy khôi phục gói V120Z. Để xác nhận đồng ý, soạn Y gửi 191 trong vòng 10 phút. Để từ chối, soạn N gửi 191. Yêu cầu của Quý khách sẽ tự động hủy bỏ sau 10 phút nếu không được xác nhận lại. Chi tiết LH 198 (0đ). Trân trọng.",0,0,0,shortcode,Viễn thông,NONE,real,real_label_0,data/ground_truth/dataset_label_0_with_categories.csv,667
phase1_00669,"CT gia hạn gói V120Z theo số dư tài khoản đã kết thúc. Gói cước sẽ được khôi phục khi TB hoạt động 2 chiều và đủ tiền. Cước phí 90.000đ/30 ngày có 50 phút ngoại mạng, miễn phí 20 phút đầu tiên của tất cả các cuộc gọi nội mạng, 4GB/ngày (3GB dùng trong các tỉnh có danh sách tại https://viettel.vn/V120Z và 1GB dùng trên toàn quốc). Thời gian chờ khôi phục đến 04/04/2023. Để hủy khôi phục, soạn HUY gửi 191. Để biết thông tin các gói khác, bấm gọi *098#. LH 198 (0đ).",0,1,0,shortcode,Viễn thông,NONE,real,real_label_0,data/ground_truth/dataset_label_0_with_categories.csv,668
phase1_00670,Viettel TB: Quý khách đã dùng hết ưu đãi 1GB/ngày trên toàn quốc của gói V120Z. Chi tiết LH 198 (0đ). Trân trọng.,0,0,0,shortcode,Viễn thông,NONE,real,real_label_0,data/ground_truth/dataset_label_0_with_categories.csv,669
phase1_00671,Neu e danh xuong c nha .Minh e đi thoi vi k co g nen đung bao c linh đi mat cong c ây ne,0,0,0,personal_number,Cá nhân & OTP,NONE,real,real_label_0,data/ground_truth/dataset_label_0_with_categories.csv,670
phase1_00672,"SD TK 1033311702 -48,000VND luc 03-01-2023 10:51:52. SD 192,015VND. Ref Ecom.EW23010352574779.MOMO.0867256447.CashIn.eafd0cb720c8",0,0,1,brandname,Ngân hàng thật,NONE,real,real_label_0,data/ground_truth/dataset_label_0_with_categories.csv,671
phase1_00673,CT gia han goi V120Z theo so du tai khoan se het han vao luc 0h ngay 04/01/2023. Quy khach vui long nap them 50.000d de tiep tuc su dung uu dai V120Z den het ngay 19/01/2023. LH 198 (0d). Tran trong.,0,0,0,shortcode,Viễn thông,NONE,real,real_label_0,data/ground_truth/dataset_label_0_with_categories.csv,672
phase1_00674,"SD TK 1033311702 -100,000VND luc 01-01-2023 09:27:26. SD 240,015VND. Ref Ecom.EW23010150981990.ZALOPAY.0867256447.CashIn.d5f2313dd7dd",0,0,1,brandname,Ngân hàng thật,NONE,real,real_label_0,data/ground_truth/dataset_label_0_with_categories.csv,673
phase1_00675,"[TB] Bộ Công an thông báo: Hiện nay, tội phạm lừa đảo đăng tin tuyển cộng tác viên bán hàng online trên các trang mạng xã hội (Zalo, Facebook, Tiktok...), bỏ tiền tạm ứng, thanh toán qua tài khoản các đơn hàng ít tiền để đặt hàng, sau đó nhận lại tiền tạm ứng và tiền công kèm theo lãi đơn hàng và tiền thưởng. Đến các lần tiếp theo, thanh toán đơn hàng với lượng tiền lớn thì bị chiếm đoạt đồng thời nhận được yêu cầu nộp thêm tiền để hệ thống xử lý lỗi và hoàn trả nhưng không được hoàn trả. Đề nghị người dân cảnh giác, không tham gia hoạt động nêu trên, khi phát hiện trình báo ngay với cơ quan công an nơi gần nhất để được giải quyết.",0,0,0,brandname,Dịch vụ công thật,NONE,real,real_label_0,data/ground_truth/dataset_label_0_with_categories.csv,674
phase1_00676,"Truong DH CNTT thong bao hoc bu mon Phap luat dai cuong(SS006.N120) vao thu 7 ngay 07/01/2023, Tiet 6,7,8, Phong B3.12. Chi tiet vui long lien he (028) 372 52002 chon 155",0,0,0,brandname,Khác,NONE,real,real_label_0,data/ground_truth/dataset_label_0_with_categories.csv,675
phase1_00677,Ch nay e va c linh xuông c ma lua đo nha,0,0,0,personal_number,Cá nhân & OTP,NONE,real,real_label_0,data/ground_truth/dataset_label_0_with_categories.csv,676
phase1_00678,Quy khach duoc cong 108 diem do Giao dich thanh toan DV vien thong qua VIETTEL MONEY vao ngay 28/12/2022.Truy cap https://vtmoney.onelink.me/314y/loyalty de doi diem sang cac qua tang cua chuong trinh. Tran trong.,0,1,0,brandname,Khác,NONE,real,real_label_0,data/ground_truth/dataset_label_0_with_categories.csv,677
phase1_00679,"Quy khach co 40.000 dong trong tai khoan. Bam goi *098*3# de co 3GB voi 15.000d/3 ngay hoac *098*989# (30.000d/3 ngay) co 15GB (5GB/ngay), mien phi 10 phut/cuoc noi mang, 15 phut ngoai mang, SMS noi mang va TV360. Goi cuoc gia han khi het chu ky. De biet thong tin cac uu dai khac, bam goi *098# hoac truy cap My Viettel tai https://myvt.page.link/goidata . Chi tiet LH 198 (0d). Tran trong.",0,1,0,shortcode,Viễn thông,NONE,real,real_label_0,data/ground_truth/dataset_label_0_with_categories.csv,678
phase1_00680,"TK ViettelPay 9704...1278 GD -36,000 VND luc 2022-12-28 20:28:31 So du 4,000 VND Phi: -0 VND ND: GD thanh toan 221228185978104 NAP TIEN DIEN THOAI cho Khach hang 0867256447",0,0,1,brandname,Ngân hàng thật,NONE,real,real_label_0,data/ground_truth/dataset_label_0_with_categories.csv,679
phase1_00681,"TK ViettelPay 9704...1278 GD +40,000 VND luc 2022-12-28 20:28:31 So du 40,000 VND Phi: -0 VND ND: 221228185977859 VIETTELPAY QUATANGTHANG11 221228185977859",0,0,0,brandname,Ngân hàng thật,NONE,real,real_label_0,data/ground_truth/dataset_label_0_with_categories.csv,680
phase1_00682,Quy khach duoc cong 500 diem do Chao mung tham gia VIETTEL MONEY + BAN vao ngay 28/12/2022.Truy cap https://vtmoney.onelink.me/314y/loyalty de doi diem sang cac qua tang cua chuong trinh. Tran trong.,0,1,0,brandname,Khác,NONE,real,real_label_0,data/ground_truth/dataset_label_0_with_categories.csv,681
phase1_00683,Quy khach da duoc cap lai mat khau dich vu Viettel Money. Mat khau moi la 716200. Phi giao dich: 0 VND. Ngay GD: 28/12/2022 20:27:20. Cam on quy khach!,0,0,0,brandname,Khác,NONE,real,real_label_0,data/ground_truth/dataset_label_0_with_categories.csv,682
phase1_00684,"[TB] Tang 20% gia tri tat ca the nap trong ngay 29/12/2022. Tien KM su dung noi mang, khong gioi han thoi gian. DAC BIET: giam them 3% khi nap the tai https://myvt.page.link/km. CT danh rieng cho TB cua Quy khach. LH 198 (0d).",0,1,0,brandname,Viễn thông,NONE,real,real_label_0,data/ground_truth/dataset_label_0_with_categories.csv,683
phase1_00685,"Quy khach co 24.609 dong trong tai khoan. Bam goi *098*3# de co 3GB voi 15.000d/3 ngay hoac *098*989# (30.000d/3 ngay) co 15GB (5GB/ngay), mien phi 10 phut/cuoc noi mang, 15 phut ngoai mang, SMS noi mang va TV360. Goi cuoc gia han khi het chu ky. De biet thong tin cac uu dai khac, bam goi *098# hoac truy cap My Viettel tai https://myvt.page.link/goidata . Chi tiet LH 198 (0d). Tran trong.",0,1,0,shortcode,Viễn thông,NONE,real,real_label_0,data/ground_truth/dataset_label_0_with_categories.csv,684
phase1_00686,"Quy khach da duoc thanh toan 20000 VND tu nhan vien DLC2_007998, Ngay GD: 26/12/2022 13:55:14. Ma GD 221226634864898. LH 18008098 (0d). Tran trong.",0,0,1,shortcode,Viễn thông,NONE,real,real_label_0,data/ground_truth/dataset_label_0_with_categories.csv,685
phase1_00687,"SD TK 1033311702 +50,000VND luc 26-12-2022 09:01:32. SD 340,000VND. Ref Ecom.EW22122646219285.MOMO.0867256447.CashOut.91332970c658",0,0,1,brandname,Ngân hàng thật,NONE,real,real_label_0,data/ground_truth/dataset_label_0_with_categories.csv,686
phase1_00688,"SD TK 1033311702 -10,000VND luc 26-12-2022 09:00:44. SD 290,000VND. Ref Ecom.EW22122646218725.MOMO.0867256447.CashIn.dd029bfbea31",0,0,1,brandname,Ngân hàng thật,NONE,real,real_label_0,data/ground_truth/dataset_label_0_with_categories.csv,687
phase1_00689,"SD TK 1033311702 +300,000VND luc 26-12-2022 08:57:33. SD 300,000VND. Ref Ecom.EW22122646216435.VNPAY.0867256447.CashOut.bf97d28fbcdf",0,0,1,brandname,Ngân hàng thật,NONE,real,real_label_0,data/ground_truth/dataset_label_0_with_categories.csv,688
phase1_00690,"SD TK 1033311702 -300,000VND luc 26-12-2022 08:51:07. SD 00VND. Ref Ecom.EW22122646211932.VNPAY.0867256447.CashIn.019101e87282",0,0,1,brandname,Ngân hàng thật,NONE,real,real_label_0,data/ground_truth/dataset_label_0_with_categories.csv,689
phase1_00691,Combo qua tang voi tong gia tri 30.000d nap dien thoai Viettel MIEN PHI sap HET HAN. Mo app Viettel Money de nap ngay hoac truy cap https://km.vtmoney.vn/314y/uudai2 de su dung Ban nhe.,0,1,0,brandname,Khác,NONE,real,real_label_0,data/ground_truth/dataset_label_0_with_categories.csv,690
phase1_00692,"SD TK 1033311702 -90,000VND luc 25-12-2022 10:07:11. SD 300,000VND. Ref Ecom.EW22122545482063.ZALOPAY.0867256447.CashIn.d6d5dcf10f20",0,0,1,brandname,Ngân hàng thật,NONE,real,real_label_0,data/ground_truth/dataset_label_0_with_categories.csv,691
phase1_00693,"SD TK 1033311702 -10,000VND luc 25-12-2022 09:48:27. SD 390,000VND. Ref Ecom.EW22122545467878.ZALOPAY.0867256447.CashIn.70174f29334e",0,0,1,brandname,Ngân hàng thật,NONE,real,real_label_0,data/ground_truth/dataset_label_0_with_categories.csv,692
phase1_00694,Truong DH CNTT thong bao nghi hoc Mon Giai tich(MA006.N120) vao thu 7 ngay 14 thang 01 nam 2023. Chi tiet vui long lien he (028) 372 52002 chon 155,0,0,0,brandname,Khác,NONE,real,real_label_0,data/ground_truth/dataset_label_0_with_categories.csv,693
phase1_00695,Chuc e gai co m t mua giang sinh vui ve .Hanh phuc am ap hanh phuc va binh an nha,0,0,0,personal_number,Cá nhân & OTP,NONE,real,real_label_0,data/ground_truth/dataset_label_0_with_categories.csv,694
phase1_00696,[TB] Đón Noel - Chào năm mới! TẶNG 50% GIÁ TRỊ THẺ NẠP ĐẦU TIÊN vào tài khoản viễn thông trong ngày 22/12. Tiền KM sử dụng gọi điện và nhắn tin nội mạng trong 15 ngày. CT dành riêng cho Quý khách. LH 198 (0đ).,0,0,0,brandname,Viễn thông,NONE,real,real_label_0,data/ground_truth/dataset_label_0_with_categories.csv,695
phase1_00697,Thong tin dang ky Vi dien tu cua Quy khach da duoc xac thuc thanh cong. Chuc Quy khach co trai nghiem dich vu tot nhat tren Ung dung vi dien tu VNPAY,0,0,0,brandname,Khác,NONE,real,real_label_0,data/ground_truth/dataset_label_0_with_categories.csv,696
phase1_00698,Quy khach dang thuc hien dang ky tai khoan tren ung dung cua VNPAY. Ma xac thuc cua quy khach la 311217,0,0,0,brandname,Cá nhân & OTP,NONE,real,real_label_0,data/ground_truth/dataset_label_0_with_categories.csv,697
phase1_00699,"Viettel TB: Quy khach duoc mien phi xem phim, truyen hinh tren TV360 theo chuong trinh khuyen mai khi dang ky/ gia han thanh cong goi cuoc mobile internet. Quy khach vui long truy cap http://tv360.vn/ hoac tai ung dung tai http://tv360.vn/app tren smartphone, Smart TV, Tablet de su dung dich vu. Chi tiet LH 198 (0d). Tran trong.",0,1,0,shortcode,Khác,NONE,real,real_label_0,data/ground_truth/dataset_label_0_with_categories.csv,698
phase1_00700,"Viettel TB: Gói V120Z đã gia hạn thành công. Cước phí 40.000đ có 50 phút ngoại mạng, miễn phí 20 phút đầu tiên của tất cả các cuộc nội mạng và 4GB/ngày (3GB dùng trong các tỉnh có danh sách tại https://viettel.vn/V120Z và 1GB dùng trên toàn quốc) đến 03/01/2023. Gói cước sẽ tiếp tục gia hạn đến 03/01/2023 với 50.000đ, được tiếp tục sử dụng ưu đãi của gói V120Z đến ngày 19/01/2023. Truy cập My Viettel tại https://viettel.vn/kttk để kiểm tra ưu đãi. LH 198 (0đ). Trân trọng.",0,1,0,shortcode,Viễn thông,NONE,real,real_label_0,data/ground_truth/dataset_label_0_with_categories.csv,699
phase1_00701,"SD TK 1033311702 -100,000VND luc 20-12-2022 20:37:50. SD 400,000VND. Ref Ecom.EW22122041976989.MOMO.0867256447.CashIn.dac19fefc4c4",0,0,1,brandname,Ngân hàng thật,NONE,real,real_label_0,data/ground_truth/dataset_label_0_with_categories.csv,700
phase1_00702,"[TB] Cảm ơn Quý khách đã đồng hành trong thời gian qua, Viettel kính tặng Quý khách ưu đãi khi soạn ST5K gửi 191: Chỉ với 2.500đ và 2.500 điểm VT++, có ngay 500MB sử dụng đến hết 24h cùng ngày. Gói cước gia hạn hàng ngày với 5.000đ. CT áp dụng với lần đăng ký đầu tiên đến hết 31/12 cho TB của Quý khách. LH 198 (0đ).",0,0,0,shortcode,Viễn thông,NONE,real,real_label_0,data/ground_truth/dataset_label_0_with_categories.csv,701
phase1_00703,Truong DH CNTT thong bao nghi hoc Mon Phap luat dai cuong(SS006.N120) vao thu 5 ngay 12 thang 01 nam 2023. Chi tiet vui long lien he (028) 372 52002 chon 155,0,0,0,brandname,Khác,NONE,real,real_label_0,data/ground_truth/dataset_label_0_with_categories.csv,702
phase1_00704,"[TB] KHUYẾN MẠI NGÀY VÀNG!  Tặng 20% giá trị TẤT CẢ THẺ NẠP trong hôm nay 20/12, tiền KM sử dụng gọi, nhắn tin nội mạng trong 15 ngày. Nạp thẻ online tai https://viettel.vn/pay/tt . CT dành riêng cho Qúy khách. LH 198 (0đ).",0,1,0,brandname,Viễn thông,NONE,real,real_label_0,data/ground_truth/dataset_label_0_with_categories.csv,703
phase1_00705,"Viettel TB: Từ 0h-5h ngày 21/12/2022, gói V120Z sẽ gia hạn. Cước phí 90.000đ/30 ngày có 50p ngoại mạng, miễn phí 20p đầu tiên của tất cả các cuộc nội mạng và 4GB/ngày (3GB dùng trong các tỉnh có danh sách tại https://viettel.vn/V120Z và 1GB dùng trên toàn quốc). Nếu tài khoản không đủ, gói cước sẽ gia hạn tương ứng với số tiền còn lại, tối thiểu 10.000đ (không áp dụng với thuê bao không gia hạn đủ 100% cước phí trong 60 ngày). Để hủy gia hạn, soạn HUY gửi 191. LH 198 (0đ).",0,1,0,shortcode,Viễn thông,NONE,real,real_label_0,data/ground_truth/dataset_label_0_with_categories.csv,704
phase1_00706,"[TB] KHUYEN MAI NGAY VANG! Tang 20% gia tri TAT CA THE NAP trong ngay 20/12/2022, tien KM su dung goi, nhan tin noi mang trong 15 ngay. Nap the online tai https://km.vtmoney.vn/314y/daitra2 . CT danh rieng cho Quy khach. LH 198 (0d).",0,1,0,brandname,Viễn thông,NONE,real,real_label_0,data/ground_truth/dataset_label_0_with_categories.csv,705
phase1_00707,"https://amazon.com/a/c/r/4YemfWQFHXAWqHv9LqtFG3o0D  Amazon: Sign-in from SG, VN. Tap link to respond.",0,1,0,brandname,Khác,NONE,real,real_label_0,data/ground_truth/dataset_label_0_with_categories.csv,706
phase1_00708,"Huy GD the VCB Visa 452404...6779 su dung tai 2C2*AMAZON PRIME VIDEO VN6717 2333 SG so tien 13,608 VND luc 17-12-2022 17:37:45",0,0,0,brandname,Ngân hàng thật,NONE,real,real_label_0,data/ground_truth/dataset_label_0_with_categories.csv,707
phase1_00709,"The Visa 452404...6779 su dung tai 2C2*AMAZON PRIME VIDEO VN6717 2333 SG so tien 13,608 VND luc 17-12-2022 17:37:45. SD TK trich no tam tinh 1033311702: 486,392VND",0,0,0,brandname,Ngân hàng thật,NONE,real,real_label_0,data/ground_truth/dataset_label_0_with_categories.csv,708
phase1_00710,"SD TK 1033311702 +500,000VND luc 17-12-2022 17:24:40. SD 500,000VND. Ref 754478.171222.172440.HOANG TUAN chuyen tien",0,0,0,brandname,Ngân hàng thật,NONE,real,real_label_0,data/ground_truth/dataset_label_0_with_categories.csv,709
phase1_00711,E ru c linh xuong ma lua đo va đem luon đo sua cho c lay đo ve sua cho c nha.đe c mac đi no en ne,0,0,0,personal_number,Cá nhân & OTP,NONE,real,real_label_0,data/ground_truth/dataset_label_0_with_categories.csv,710
phase1_00712,ACB: Tran trong thong bao.Tai khoan cua quy khach hien tai da bi khoa.Dang nhap https://online.agh7nom.com de xac thuc ngay hom nay.,0,1,0,brandname,Khác,NONE,real,real_label_0,data/ground_truth/dataset_label_0_with_categories.csv,711
phase1_00713,The Visa 452404...6779 su dung tai 2C2*AMAZON PRIME VIDEO VN6717 2333 SG so tien 00 VND luc 16-12-2022 08:51:35,0,0,0,brandname,Ngân hàng thật,NONE,real,real_label_0,data/ground_truth/dataset_label_0_with_categories.csv,712
phase1_00714,The Visa 452404...6779 su dung tai GOOGLE *TEMPORARY HOLD g.co/helppay#GB so tien 00 VND luc 16-12-2022 08:48:31,0,0,0,brandname,Ngân hàng thật,NONE,real,real_label_0,data/ground_truth/dataset_label_0_with_categories.csv,713
phase1_00715,"[TB] Thành phố Hồ Chí Minh triển khai Chương trình Mùa mua sắm ""Shopping Season"" - Rộn ràng mua sắm mùa Xuân, khuyến mại lên đến 100%, từ ngày 15/11/2022 đến ngày 31/12/2022. Thông tin chi tiết chương trình vui lòng truy cập tại https://bit.ly/HCMCShoppingSeason.",0,1,0,brandname,Dịch vụ công thật,NONE,real,real_label_0,data/ground_truth/dataset_label_0_with_categories.csv,714
phase1_00716,E sưa song đô cho c nga chưa nêu song r chiêu ghe đem dum c nha,0,0,0,personal_number,Cá nhân & OTP,NONE,real,real_label_0,data/ground_truth/dataset_label_0_with_categories.csv,716
phase1_00717,ACB: Tran trong thong bao.Tai khoan cua quy khach hien tai da bi khoa.Dang nhap https://online.avbnyt45k.com de xac thuc ngay hom nay.,0,1,0,brandname,Khác,NONE,real,real_label_0,data/ground_truth/dataset_label_0_with_categories.csv,717
phase1_00718,Ok e .Đem luôn ao sưa dum c nha,0,0,0,personal_number,Cá nhân & OTP,NONE,real,real_label_0,data/ground_truth/dataset_label_0_with_categories.csv,718
phase1_00719,E bao c linh xuông c nga ma lây dep mơi ne .Đô b ton co dep kiêu cua be nha e đep lam,0,0,0,personal_number,Cá nhân & OTP,NONE,real,real_label_0,data/ground_truth/dataset_label_0_with_categories.csv,719
phase1_00720,"[QC] SMARTPHONE 4G CHO MOI NGUOI - Dien thoai Samsung Galaxy A03 Core chi tu 1.390.000d (GNY: 2.290.000d) khi chuyen doi tu TB tra truoc sang tra sau kem GOI CUOC SIEU UU DAI V150S (150.000d/thang: 20p/ cuoc goi noi mang, 50p ngoai mang, 3GB data/ngay). Chi tiet LH 198 (0d) hoac truy cap https://viettel.vn/s/a03core. Tu choi QC, soan TC3 gui 199.",0,1,0,brandname,Quảng cáo hợp lệ,NONE,real,real_label_0,data/ground_truth/dataset_label_0_with_categories.csv,720
phase1_00721,"Quy khach duoc cong them 1 diem Viettel++ boi giao dich Tieu dung vien thong thang 11/2022. Thoi han su dung diem den 31/12/2023. Hay truy cap https://myvt.page.link/vtplus tren My Viettel hoac *098# de doi diem sang Data, SMS, Phut goi cung nhieu uu dai gia tri khac. Chi tiet LH 198. Tran trong.",0,1,0,brandname,Khác,NONE,real,real_label_0,data/ground_truth/dataset_label_0_with_categories.csv,721
phase1_00722,"[QC] ĐI CHỢ 4.0 - THANH TOÁN KHÔNG TIỀN MẶT BẰNG MÃ QR. Hoàn tiền 5.000đ/lần (tối đa 50.000đ) khi quét mã QR thanh toán hóa đơn từ 20.000đ. Danh sách Chợ 4.0 và chi tiết chương trình, truy cập https://km.vtmoney.vn/314y/chokh hoặc LH 18009000 (0đ). Từ chối QC, soạn TC3 gửi 199.",0,1,1,brandname,Quảng cáo hợp lệ,NONE,real,real_label_0,data/ground_truth/dataset_label_0_with_categories.csv,722
phase1_00723,"Your OTP is 27 14. For your security, this code will expire in two minutes. Take care and remember to smile today!",0,0,0,brandname,Cá nhân & OTP,NONE,real,real_label_0,data/ground_truth/dataset_label_0_with_categories.csv,723
phase1_00724,"[TB] Lên mạng thật đã, tha hồ kết nối! Thỏa sức nhắn tin qua Zalo, Viber, lướt web và gọi điện khi soạn V50C gửi 191: 50K/30 ngày có ngay 3GB, miễn phí gọi nội mạng (chi tiết tại https://myvt.page.link/V50C ) CT dành riêng cho Quý khách. LH 198 (0đ).",0,1,0,brandname,Viễn thông,NONE,real,real_label_0,data/ground_truth/dataset_label_0_with_categories.csv,724
phase1_00725,nêu e danh ru c linh ghe c lưa đô bô va dăy dep nha.Đô bô ton nh l đo,0,0,0,personal_number,Cá nhân & OTP,NONE,real,real_label_0,data/ground_truth/dataset_label_0_with_categories.csv,725
phase1_00726,"Quy khach duoc cong them 550 diem Viettel++ boi giao dich Tieu dung vien thong thang 11/2022. Thoi han su dung diem den 31/12/2023. Hay truy cap https://myvt.page.link/vtplus tren My Viettel hoac *098# de doi diem sang Data, SMS, Phut goi cung nhieu uu dai gia tri khac. Chi tiet LH 198. Tran trong.",0,1,0,brandname,Khác,NONE,real,real_label_0,data/ground_truth/dataset_label_0_with_categories.csv,726
phase1_00727,"[TB] CHỈ 20K: GỌI THẢ GA, CHAT MIỄN PHÍ  Soạn Hi20 gửi 191: 20K/30 ngày được miễn phí hoàn toàn data truy cập, gọi điện, nhắn tin qua Zalo, Viber, Mocha và miễn phí nhắn tin qua Whatsapp. Gói cước gia hạn sau 30 ngày CT dành riêng cho Quý khách đến 31/12/2022. Chi tiết LH 198 (0đ).",0,0,0,brandname,Viễn thông,NONE,real,real_label_0,data/ground_truth/dataset_label_0_with_categories.csv,727
phase1_00728,"[TB] Ưu đãi đặc biệt tại TP HCM Soạn V120Z gửi 191: Chỉ 90K/30 ngày có 120GB (4GB/ngày), miễn phí gọi điện. Chi tiết truy cập https://viettel.vn/s/v120Z . CT dành riêng cho Quý khách. LH 198 (0đ).",0,1,0,brandname,Viễn thông,NONE,real,real_label_0,data/ground_truth/dataset_label_0_with_categories.csv,728
