sample_id,content,label,has_url,has_phone_number,sender_type,category,obfuscation_level,data_origin,source_dataset,source_file,source_row_id
phase1_01837,"Dang ky thanh cong goi D7 (7.000d/ngay co 1,2GB data toc do cao, het 1,2GB tinh theo goi dang su dung). Hieu luc den 18:48 22/08/2022. Goi cuoc gia han tu dong hang ngay. Kiem tra dung luong, soan DATAKM gui 888. De huy soan HUY D7 gui 888",0,0,0,shortcode,Viễn thông,NONE,real,real_label_0,data/ground_truth/dataset_label_0_with_categories.csv,1841
phase1_01838,Ma OTP 843519 la ma xac thuc giao dich tai TK VNPT Money cua ban. Vui long khong chia se voi bat ky ai!,0,0,0,brandname,Cá nhân & OTP,NONE,real,real_label_0,data/ground_truth/dataset_label_0_with_categories.csv,1842
phase1_01839,"CHÚ Ý: NẾU CÓ BẤT KỲ THÍ SINH NÀO VÌ LÝ DO NGOÀI MONG MUỐN MÀ CHƯA ĐĂNG KÝ ĐƯỢC NGUYỆN VỌNG XÉT TUYỂN VÀO CÁC TRƯỜNG ĐẠI HỌC, THÔNG TIN NGAY VỀ VỤ GIÁO DỤC ĐẠI HỌC (Bộ GDĐT) QUA ĐỊA CHỈ EMAIL: pvluong@moet.gov.vn TRONG VÒNG 03 NGÀY TỪ 21/8/2022 ĐẾN 23/8/2022. *Thông tin từ Bộ Giáo dục và Đào tạo",0,1,0,brandname,Khác,NONE,real,real_label_0,data/ground_truth/dataset_label_0_with_categories.csv,1843
phase1_01840,(QC) Ngân hàng VIB kính tặng quý khách thẻ tín dụng Online Plus hoàn tiền mua hàng 6% - hạn mức lên tới 100 triệu đồng. MIỄN PHÍ THƯỜNG NIÊN TRỌN ĐỜI*. Từ chối soạn BL gửi 1379. Đký & nhận thẻ sau 30p: https://onlinecard.vib.com.vn/offer/op_sms,0,1,0,brandname,Quảng cáo hợp lệ,NONE,real,real_label_0,data/ground_truth/dataset_label_0_with_categories.csv,1844
phase1_01841,"Dang ky thanh cong goi D7 (7.000d/ngay co 1,2GB data toc do cao, het 1,2GB tinh theo goi dang su dung). Hieu luc den 09:20 22/08/2022. Goi cuoc gia han tu dong hang ngay. Kiem tra dung luong, soan DATAKM gui 888. De huy soan HUY D7 gui 888",0,0,0,shortcode,Viễn thông,NONE,real,real_label_0,data/ground_truth/dataset_label_0_with_categories.csv,1845
phase1_01842,"(TB2) Quy khach da cap nhat thanh cong thong tin thue bao 0828054353 tai app MyVNPT vao ngay 05/08/2022. Sau ngay 01/04/2022, VinaPhone se khong giai quyet cac tranh chap, khieu nai ve sang ten, chuyen quyen (neu co). Chi tiet LH 18001091 (0đ). Tran trong!",0,0,1,brandname,Khác,NONE,real,real_label_0,data/ground_truth/dataset_label_0_with_categories.csv,1846
phase1_01843,Aaaa,0,0,0,personal_number,Cá nhân & OTP,NONE,real,real_label_0,data/ground_truth/dataset_label_0_with_categories.csv,1847
phase1_01844,Thí sinh lưu ý: Chỉ còn 2 ngày nữa để đăng ký nguyện vọng vào Đại học FPT bằng cách truy cập vào hệ thống hỗ trợ tuyển sinh chung của Bộ GD&ĐT theo địa chỉ: https://thisinh.thithptquocgia.edu.vn/. Hotline hỗ trợ tư vấn: 02873005588,0,1,1,brandname,Khác,NONE,real,real_label_0,data/ground_truth/dataset_label_0_with_categories.csv,1848
phase1_01845,Chao Quy PH-HS da dang ky tham gia Hoi thao Hoi&Dap Tuyen sinh 2022 - Dai hoc FPT. Chuong trinh se bat dau luc 19:00 toi nay. Moi Quy PH-HS tham du bang duong link: https://us02web.zoom.us/j/84853187652 hoac Zoom ID: 848 5318 7652. Mat khau vao phong: FPT. Hotline (028) 7300 5588.,0,1,1,brandname,Khác,NONE,real,real_label_0,data/ground_truth/dataset_label_0_with_categories.csv,1849
phase1_01846,(TB) Chúc bạn tuần mới ngập tràn niềm vui! VinaPhone tặng Bạn 20% khi nạp thẻ vào HÔM NAY 16/8/2022 (khuyến mại sử dụng gọi/nhắn tin trong 15 ngày). Dễ dàng nạp tiền online tại ứng dụng MyVNPT (my.vnpt.com.vn/app) CSKH 18001091 (0đ).,0,1,1,brandname,Viễn thông,NONE,real,real_label_0,data/ground_truth/dataset_label_0_with_categories.csv,1850
phase1_01847,"[Nhắc lịch] Quý phụ huynh và các bạn học sinh thân mến, Hội thảo trực tuyến ""Hỏi & Đáp Tuyển sinh Đại học FPT 2022"", kết nối trực tiếp với đội ngũ giảng viên tiêu biểu của tất cả các ngành đang đào tạo tại Trường sắp diễn ra trong 24h tới. Thời gian diễn ra hội thảo: từ 19g - 21g Thứ tư ngày 17/8/2022. Vui lòng đăng ký trước và đặt câu hỏi để được ưu tiên giải đáp: https://bit.ly/Webinar-DHFPT-1708",0,1,0,brandname,Khác,NONE,real,real_label_0,data/ground_truth/dataset_label_0_with_categories.csv,1851
phase1_01848,"ĐH FPT kính mời quý vị phụ huynh, các em học sinh tham dự hội thảo trực tuyến ""Hỏi & Đáp Tuyển sinh 2022"", kết nối trực tiếp với đội ngũ giảng viên tiêu biểu của tất cả các ngành đang đào tạo tại ĐH FPT. Thời gian: từ 19g - 21g Thứ tư ngày 17/8. Vui lòng đăng ký trước và đặt câu hỏi để được ưu tiên giải đáp: https://bit.ly/Webinar-DHFPT-1708",0,1,0,brandname,Khác,NONE,real,real_label_0,data/ground_truth/dataset_label_0_with_categories.csv,1852
phase1_01849,(TB) Cuối tuần vui vẻ - VinaPhone tặng Bạn 20% khi nạp thẻ vào HÔM NAY 12/8/2022 (khuyến mại sử dụng gọi/nhắn tin trong 15 ngày). THÊM 4% chiết khấu và nhiều quà tặng hấp dẫn nếu nạp qua VNPT Money tại https://km.vnptmoney.vn/NgayVang CSKH 18001091 (0đ).,0,1,1,brandname,Viễn thông,NONE,real,real_label_0,data/ground_truth/dataset_label_0_with_categories.csv,1853
phase1_01850,CAO DANG ANH QUOC BTEC FPT Tuyen bo sung 50 chi tieu  Xet tuyen bang HOC BA Gioi thieu viec lam sau khi ra truong LH:0961691393 https://btec.fpt.edu.vn/r/d7,0,1,1,brandname,Khác,NONE,real,real_label_0,data/ground_truth/dataset_label_0_with_categories.csv,1854
phase1_01851,"Kinh chao Quy khach, tong dai khong lien he duoc Quy khach, de duoc ho tro ve dich vu di dong VinaPhone, QK vui long lien he tong dai 18001091 (mien phi). Tran trong",0,0,1,brandname,Viễn thông,NONE,real,real_label_0,data/ground_truth/dataset_label_0_with_categories.csv,1855
phase1_01852,(TB) VinaPhone mến tặng riêng Bạn ưu đãi 20% khi nạp thẻ từ 20.000đ trở lên vào HÔM NAY 09/8/2022. Khuyến mại sử dụng gọi/nhắn tin trong 15 ngày. Dễ dàng nạp tiền online tại ứng dụng MyVNPT my.vnpt.com.vn/app. CSKH 18001091 (0đ).,0,1,1,brandname,Viễn thông,NONE,real,real_label_0,data/ground_truth/dataset_label_0_with_categories.csv,1856
phase1_01853,"(QC) CHUC MUNG! Ban du dieu kien duoc TANG MIEN PHI 200mb data. Soan DK gui 9923 de nhan 1.2GB+200MB tu goi BIG50 (50.000d/30 ngay). Tu choi QC, soan TC gui 9923. CSKH 18001091.",0,0,1,brandname,Quảng cáo hợp lệ,NONE,real,real_label_0,data/ground_truth/dataset_label_0_with_categories.csv,1857
phase1_01854,(TB) VinaPhone mến tặng riêng Bạn ưu đãi 20% khi nạp thẻ từ 20.000đ trở lên vào NGÀY MAI 09/8/2022. Khuyến mại sử dụng gọi/nhắn tin trong 15 ngày. Dễ dàng nạp tiền online tại ứng dụng MyVNPT my.vnpt.com.vn/app. CSKH 18001091 (0đ).,0,1,1,brandname,Viễn thông,NONE,real,real_label_0,data/ground_truth/dataset_label_0_with_categories.csv,1858
phase1_01855,Mời bạn tham gia  Webinar: 1001 sự thật về FPT. Hẹn gặp tại Zoom ID: 862 4470 8778 hoặc link zoom: https://us02web.zoom.us/j/86244708778 Pass: FPT. Hỗ trợ kỹ thuật tại: https://www.facebook.com/FPTU.HCM,0,1,0,brandname,Khác,NONE,real,real_label_0,data/ground_truth/dataset_label_0_with_categories.csv,1859
phase1_01856,A lô,0,0,0,personal_number,Cá nhân & OTP,NONE,real,real_label_0,data/ground_truth/dataset_label_0_with_categories.csv,1860
phase1_01857,"Truong DH Binh Duong tang 15%hoc phi, tang 50% le phi nhap hoc, tang hoc bong nganh mui nhon 12 trieu khi dang ky NV1. Lh: 0827927468 xettuyenonline.bdu.edu.vn",0,1,1,brandname,Khác,NONE,real,real_label_0,data/ground_truth/dataset_label_0_with_categories.csv,1861
phase1_01858,"(TB) VinaPhone vui mừng tặng Bạn NGÀY VÀNG, ưu đãi 20% khi nạp thẻ vào HÔM NAY 05/8/2022. Khuyến mại sử dụng gọi/nhắn tin trong 15 ngày. CSKH 18001091 (0đ).",0,0,1,brandname,Viễn thông,NONE,real,real_label_0,data/ground_truth/dataset_label_0_with_categories.csv,1862
phase1_01859,"TB1) Quy khach da cap nhat thanh cong thong tin thue bao 0828054353 tai app MyVNPT vao ngay 05/08/2022! Ke tu thoi điem nay den truoc ngay 01/04/2022, viec thay doi TTTB hoac/va chuyen quyen cua QK se khong duoc giai quyet. Chi tiet LH 18001091. Tran trong!",0,0,1,brandname,Khác,NONE,real,real_label_0,data/ground_truth/dataset_label_0_with_categories.csv,1863
phase1_01860,"(TB) Thue bao 0828054353 cua Quy khach da cap nhat thanh cong Thong tin thue bao vao 11h36 ngay 05/08/2022. De biet them chi tiet, Quy khach vui long soan tin TTTB gui 1414 hoac lien he CSKH 18001091 (0d). Tran trong!",0,0,1,brandname,Khác,NONE,real,real_label_0,data/ground_truth/dataset_label_0_with_categories.csv,1864
phase1_01861,698857 la ma xac nhan OTP MyVNPT cua ban. Vui long nhap ma OTP trong vong 2 phut. Va KHONG chia se ma nay voi nguoi khac.,0,0,0,brandname,Cá nhân & OTP,NONE,real,real_label_0,data/ground_truth/dataset_label_0_with_categories.csv,1865
phase1_01862,"Chuc mung quy khach da dang ky thanh cong tai khoan tai http://vinaphone.com.vn. De lay mat khau truy cap, quy khach hay soan tin MK gui 333 !",0,1,0,shortcode,Khác,NONE,real,real_label_0,data/ground_truth/dataset_label_0_with_categories.csv,1866
phase1_01863,712016 la ma xac nhan OTP MyVNPT cua ban. Vui long nhap ma OTP trong vong 2 phut. Va KHONG chia se ma nay voi nguoi khac.,0,0,0,brandname,Cá nhân & OTP,NONE,real,real_label_0,data/ground_truth/dataset_label_0_with_categories.csv,1867
phase1_01864,792840 la ma xac nhan OTP MyVNPT cua ban. Vui long nhap ma OTP trong vong 2 phut. Va KHONG chia se ma nay voi nguoi khac.,0,0,0,brandname,Cá nhân & OTP,NONE,real,real_label_0,data/ground_truth/dataset_label_0_with_categories.csv,1868
phase1_01865,353447 la ma xac nhan OTP MyVNPT cua ban. Vui long nhap ma OTP trong vong 2 phut. Va KHONG chia se ma nay voi nguoi khac.,0,0,0,brandname,Cá nhân & OTP,NONE,real,real_label_0,data/ground_truth/dataset_label_0_with_categories.csv,1869
phase1_01866,TNN Hai-12A02: Truong THPT Tran Bien thong bao:Hs dang ky xet tuyen Dai hoc truc tuyen tu ngay 22/7 den 20/8/2022 (xem chi tiet tren website truong).Tu 8h00 den 11h00 cac ngay 01/8 va 02/8/2022:Hs den truong nhan giay tot nghiep tam thoi va giay chung nhan ket qua thi Tot nghiep THPT 2022. Khi di mang theo CMND/CCCD hoac the du thi.Neu nguoi nha di nhan thay thi mang theo CMND/CCCD va so ho khau de doi chieu.Tran trong,0,0,0,personal_number,Khác,NONE,real,real_label_0,data/ground_truth/dataset_label_0_with_categories.csv,1870
phase1_01867,(VINAPHONE PLUS TB) Diem tich luy cua Quy Hoi vien den thang 06/2022 la 23 diem VinaPhone Plus. Chi tiet lien he 18001091. Tran trong cam on!,0,0,1,brandname,Khác,NONE,real,real_label_0,data/ground_truth/dataset_label_0_with_categories.csv,1871
phase1_01868,Bố xong chưa,0,0,0,personal_number,Cá nhân & OTP,NONE,real,real_label_0,data/ground_truth/dataset_label_0_with_categories.csv,1872
phase1_01869,QK da thanh toan thanh cong 24.200d tren Google Play. Chi tiet lien he 18001091 (mien phi),0,0,1,brandname,Viễn thông,NONE,real,real_label_0,data/ground_truth/dataset_label_0_with_categories.csv,1873
phase1_01870,DH Greenwich - FPT Edu tuyen 300 chi tieu cuoi. Xet tuyen thang bang hoc ba >=7.0 hoac diem thi THPT >=18. Nop ho so ngay https://bit.ly/gwvietnam 0906111040,0,1,1,brandname,Khác,NONE,real,real_label_0,data/ground_truth/dataset_label_0_with_categories.csv,1874
phase1_01871,T/B: DH FPT luu y thi sinh chi su dung cung 1 so CMND/CCCD cho viec dang ky xet tuyen tai DH FPT va dang ky nguyen vong tai https://thisinh.thithptquocgia.edu.vn/. Truong hop thi sinh dang su dung 2 so khac nhau thi vui long lien he ngay CBTV hoac tong dai 02873005588 de duoc cap nhat.,0,1,1,brandname,Khác,NONE,real,real_label_0,data/ground_truth/dataset_label_0_with_categories.csv,1875
phase1_01872,"(QC) Vong tay thong diep Drop moi nhat 2022 da ra mat, ghe tham VERUS ban nhe! https://shopee.vn/verus.official . Tu choi soan TC VERUS gui 1551 hoac lien he 18001091 (mien phi).",0,1,1,brandname,Quảng cáo hợp lệ,NONE,real,real_label_0,data/ground_truth/dataset_label_0_with_categories.csv,1876
phase1_01873,"(TB) Vì yêu thương là không chờ đợi, VinaPhone tặng riêng Bạn ưu đãi 20% khi nạp thẻ vào HÔM NAY 26/7/2022. Khuyến mại sử dụng gọi/nhắn tin trong 15 ngày. Dễ dàng nạp tiền online tại ứng dụng MyVNPT my.vnpt.com.vn/app. CSKH 18001091 (0đ).",0,1,1,brandname,Viễn thông,NONE,real,real_label_0,data/ground_truth/dataset_label_0_with_categories.csv,1877
phase1_01874,"Chào bạn Trần Nguyễn Nam Hải, ĐH FPT trân trọng thông báo: Để có cơ hội trúng tuyển đợt 1 năm 2022 thí sinh cần Đăng ký ""FPT"" là nguyện vọng xét tuyển trên hệ thống hỗ trợ tuyển sinh chung của Bộ GD&ĐT. Hotline hỗ trợ tư vấn: 02873005588 hoặc cán bộ tư vấn Trần Thị Linh Huệ (huettl@fe.edu.vn)",0,0,1,brandname,Khác,NONE,real,real_label_0,data/ground_truth/dataset_label_0_with_categories.csv,1878
phase1_01875,"Chi can tot nghiep THPT, xet hoc ba NGAY Melbourne Polytechnic FPT. Duoc gioi thieu viec lam, Moi truong hoc chuan UC. DK: melbourne.fpt.edu.vn/r/hbs 0961398466",0,1,1,brandname,Khác,NONE,real,real_label_0,data/ground_truth/dataset_label_0_with_categories.csv,1879
phase1_01876,Chuc mung Tran Nguyen Nam Hai duoc tang hoc bong 12 trieu khi DK NV1 vao DH Binh Duong http://thisinh.thitotnghiepthpt.edu.vn MT: DBD _ 0827927468,0,1,1,brandname,Khác,NONE,real,real_label_0,data/ground_truth/dataset_label_0_with_categories.csv,1880
phase1_01877,(TB) VinaPhone tặng bạn NGÀY VÀNG ƯU ĐÃI 20% khi nạp tiền vào hôm nay 22/7. NHẬN THÊM 4% chiết khấu và nhiều quà tặng hấp dẫn khi nạp qua VNPT Money tại https://km.vnptmoney.vn/NgayVang CSKH 18001091 (#3).,0,1,1,brandname,Viễn thông,NONE,real,real_label_0,data/ground_truth/dataset_label_0_with_categories.csv,1881
phase1_01878,Mã xác thực Discord của bạn là: 295277,0,0,0,brandname,Cá nhân & OTP,NONE,real,real_label_0,data/ground_truth/dataset_label_0_with_categories.csv,1882
phase1_01879,"DH Gia Dinh TP.HCM xet tuyen hoc ba THPT. Dao tao 3 nam, hoc phi 7,5-12,5 tr/HK.Xet tuyen tu 20-31/7. Link: https://bit.ly/3RLMLCg. LH:0962121018-0862121018",0,1,1,brandname,Khác,NONE,real,real_label_0,data/ground_truth/dataset_label_0_with_categories.csv,1883
phase1_01880,Twitter confirmation code: 5un2c9j7,0,0,0,brandname,Cá nhân & OTP,NONE,real,real_label_0,data/ground_truth/dataset_label_0_with_categories.csv,1884
phase1_01881,"[TB] Tich cuc tham gia Cuoc thi truc tuyen ""Tim hieu Luat Canh sat bien Viet Nam"" tai dia chi: https://thitimhieuluatcanhsatbienvietnam.vn la gop phan bao ve bien, dao cua To quoc trong tinh hinh moi.",0,1,0,brandname,Dịch vụ công thật,NONE,real,real_label_0,data/ground_truth/dataset_label_0_with_categories.csv,1885
phase1_01882,"VNeID: Ma OTP 574250 co hieu luc trong 3 phut, su dung de xac thuc cho yeu cau dang nhap thiet bi moi. Vi ly do bao mat, tuyet doi khong duoc cung cap ma OTP nay cho bat ky ai. Tran trong!",0,0,0,brandname,Cá nhân & OTP,NONE,real,real_label_0,data/ground_truth/dataset_label_0_with_categories.csv,1886
phase1_01883,"Quy khach la hoi vien Tiem nang chuong trinh Viettel++ chu ky tu 29/08/2025 den 29/08/2026. Hien tai Quy khach co 6.519 diem xet hang va 84 diem tieu dung. De biet chi tiet, vui long truy cap https://vietteltelecom.vn/vtplus hoac LH 198 (0d). Tran trong.",0,1,0,brandname,Khác,NONE,real,real_label_0,data/ground_truth/dataset_label_0_with_categories.csv,1887
phase1_01884,"021089 is your GRAB sign-in code. It expires in 2 minutes. Do not share it with anyone, including GRAB.",0,0,0,brandname,Cá nhân & OTP,NONE,real,real_label_0,data/ground_truth/dataset_label_0_with_categories.csv,1888
phase1_01885,"[TB] Nap lien tay, Khuyen mai ngay. Tang 20% gia tri tat ca the nap vao tai khoan vien thong trong ngay 29/11/2025. Tien KM su dung truy cap Internet trong 15 ngay. Nap the online tai cac vi dien tu, ung dung thanh toan hoac tai https://viettel.vn/naptienkm . CT ap dung cho thue bao nhan duoc tin nhan. LH 198 (0d).",0,1,0,brandname,Viễn thông,NONE,real,real_label_0,data/ground_truth/dataset_label_0_with_categories.csv,1889
phase1_01886,"Viettel TB: Gói KS8 đã kết thúc. Để biết các ưu đãi khác, truy cập https://viettel.vn/goidata hoặc bấm gọi *098#. Chi tiết LH 198 (0đ). Trân trọng.",0,1,0,shortcode,Viễn thông,NONE,real,real_label_0,data/ground_truth/dataset_label_0_with_categories.csv,1890
phase1_01887,"Quý khách đã đăng ký thành công gói KS8: 8.000đ có 1,2GB sử dụng đến 23:59:59 ngày 25/11/2025. Truy cập https://viettel.vn/kttk để kiểm tra ưu đãi. Soạn HUY KS8 gửi 191 để hủy gói cước. Chi tiết LH 198 (0đ). Trân trọng.",0,1,0,shortcode,Viễn thông,NONE,real,real_label_0,data/ground_truth/dataset_label_0_with_categories.csv,1891
phase1_01888,"Quý khách đã đăng ký thành công gói KS8: 8.000đ có 1,2GB sử dụng đến 23:59:59 ngày 24/11/2025. Truy cập https://viettel.vn/kttk để kiểm tra ưu đãi. Soạn HUY KS8 gửi 191 để hủy gói cước. Chi tiết LH 198 (0đ). Trân trọng.",0,1,0,shortcode,Viễn thông,NONE,real,real_label_0,data/ground_truth/dataset_label_0_with_categories.csv,1892
phase1_01889,"[TB] Nap lien tay, Khuyen mai ngay. Tang 20% gia tri tat ca the nap vao tai khoan vien thong trong ngay 22/11/2025. Tien KM su dung truy cap Internet trong 15 ngay. Nap the online tai cac vi dien tu, ung dung thanh toan hoac tai https://viettel.vn/naptienkm . CT ap dung cho thue bao nhan duoc tin nhan. LH 198 (0d).",0,1,0,brandname,Viễn thông,NONE,real,real_label_0,data/ground_truth/dataset_label_0_with_categories.csv,1893
phase1_01890,"VNeID: Ma OTP 200927 co hieu luc trong 3 phut, su dung de xac thuc cho yeu cau lay lai mat khau. Vi ly do bao mat, tuyet doi khong duoc cung cap ma OTP nay cho bat ky ai. Tran trong!",0,0,0,brandname,Cá nhân & OTP,NONE,real,real_label_0,data/ground_truth/dataset_label_0_with_categories.csv,1894
phase1_01891,"[TB] Nap lien tay, Khuyen mai ngay. Tang 20% gia tri tat ca the nap vao tai khoan vien thong trong ngay 19/11/2025. Tien KM su dung truy cap Internet trong 15 ngay. Nap the online tai cac vi dien tu, ung dung thanh toan hoac tai https://viettel.vn/naptienkm . CT ap dung cho thue bao nhan duoc tin nhan. LH 198 (0d).",0,1,0,brandname,Viễn thông,NONE,real,real_label_0,data/ground_truth/dataset_label_0_with_categories.csv,1895
phase1_01892,[KHAO SAT] VIETTEL kinh moi Quy khach danh gia chat luong dich vu: Vui long cho biet muc do hai long voi dich vu THOAI DI DONG bang cach nhap so diem tu 1 den 5 va phan hoi lai tin nhan nay (mien phi): 4-5: Hai long 3: Binh thuong 1-2: Khong hai long,0,0,0,shortcode,Khác,NONE,real,real_label_0,data/ground_truth/dataset_label_0_with_categories.csv,1896
phase1_01893,"VNeID: Ma OTP 211045 co hieu luc trong 3 phut, su dung de xac thuc cho yeu cau kich hoat tai khoan. Vi ly do bao mat, tuyet doi khong duoc cung cap ma OTP nay cho bat ky ai. Tran trong!",0,0,0,brandname,Cá nhân & OTP,NONE,real,real_label_0,data/ground_truth/dataset_label_0_with_categories.csv,1897
phase1_01894,G-441032 là mã xác minh Google của bạn. Đừng chia sẻ với bất kỳ ai.,0,0,0,brandname,Cá nhân & OTP,NONE,real,real_label_0,data/ground_truth/dataset_label_0_with_categories.csv,1898
phase1_01895,"VNeID: Ma OTP 708459 co hieu luc trong 3 phut, su dung de xac thuc cho yeu cau kich hoat tai khoan. Vi ly do bao mat, tuyet doi khong duoc cung cap ma OTP nay cho bat ky ai. Tran trong!",0,0,0,brandname,Cá nhân & OTP,NONE,real,real_label_0,data/ground_truth/dataset_label_0_with_categories.csv,1899
phase1_01896,"VNeID: Ma OTP 339499 co hieu luc trong 3 phut, su dung de xac thuc cho yeu cau kich hoat tai khoan. Vi ly do bao mat, tuyet doi khong duoc cung cap ma OTP nay cho bat ky ai. Tran trong!",0,0,0,brandname,Cá nhân & OTP,NONE,real,real_label_0,data/ground_truth/dataset_label_0_with_categories.csv,1900
phase1_01897,Cuc Canh sat QLHC ve TTXH thong bao: Ho so dang ky thay doi so dien thoai cua cong dan da duoc xu ly. Tran trong,0,0,0,brandname,Dịch vụ công thật,NONE,real,real_label_0,data/ground_truth/dataset_label_0_with_categories.csv,1901
phase1_01898,"Tai khoan cua Quy khach sap het. Soan: 1 gui 211 de cong 10 phut noi mang (800d/p), su dung trong 7 ngay 2 gui 211 de cong 3 phut ngoai mang (1.400d/p), su dung trong 7 ngay 3 gui 211 de cong 30 tin nhan noi mang (245d/tin), su dung trong 7 ngay Chi tiet LH 18008098 (mien phi).",0,0,1,shortcode,Viễn thông,NONE,real,real_label_0,data/ground_truth/dataset_label_0_with_categories.csv,1902
phase1_01899,"[QC] Gói 5G10MYT: Chỉ 10.000đ có 6GB data và 2GB truy cập YouTube, ưu đãi sử dụng đến 24h ngày đăng ký. Gói cước không gia hạn. Mua gói ngay tại https://myviettel.go.link/91ZnT. Chi tiết LH 198 (0đ). Từ chối QC, soạn TC3 gửi 199.",0,1,0,brandname,Quảng cáo hợp lệ,NONE,real,real_label_0,data/ground_truth/dataset_label_0_with_categories.csv,1903
phase1_01900,"[TB] Trả sau giá hời - Data, gọi thả ga Gói V120K - Giá 120K/tháng có: - 1,5GB/ngày. - 50p ngoại mạng, miễn phí 20p/cuộc nội mạng.  Gói cước gia hạn theo tháng. CT dành riêng cho Quý khách. LH 18008168 (0đ) để đăng ký.",0,0,1,brandname,Viễn thông,NONE,real,real_label_0,data/ground_truth/dataset_label_0_with_categories.csv,1904
phase1_01901,"[QC] Mua gói SD30S trên My Viettel chỉ 30.000đ/7 ngày có tối đa 2GB/ngày. Gói cước không gia hạn. Đăng ký ngay tại https://myviettel.go.link/ch4q6. Chi tiết LH 198 (0đ). Từ chối QC, soạn TC3 gửi 199.",0,1,0,brandname,Quảng cáo hợp lệ,NONE,real,real_label_0,data/ground_truth/dataset_label_0_with_categories.csv,1905
phase1_01902,"[QC] Tham gia ngay chương trình Chiến binh đua top Cúp TV360 tại https://tv360.vn/game/st để có cơ hội nhận các phần quà hấp dẫn: Điện thoại iPhone 17 Promax, Airpods, iPad Air M3… Chi tiết LH 18008119 (0đ). Từ chối QC, soạn TC4 gửi 199.",0,1,1,brandname,Quảng cáo hợp lệ,NONE,real,real_label_0,data/ground_truth/dataset_label_0_with_categories.csv,1906
phase1_01903,"[TB] Nap lien tay, Khuyen mai ngay. Tang 20% gia tri tat ca the nap vao tai khoan vien thong trong ngay 08/11/2025. Tien KM su dung truy cap Internet trong 15 ngay. Nap the online tai cac vi dien tu, ung dung thanh toan hoac tai https://viettel.vn/naptienkm . CT ap dung cho thue bao nhan duoc tin nhan. LH 198 (0d).",0,1,0,brandname,Viễn thông,NONE,real,real_label_0,data/ground_truth/dataset_label_0_with_categories.csv,1907
phase1_01904,"[QC] GIA NHẬP GIC, ĐẪM DATA, ĐẬM CÁ TÍNH! Thắng đời 1-0 khi trở thành thành viên GIC: - Gói cước rẻ mà data ""khủng long"" mỗi ngày. - Đặc quyền ""sít rịt"": Sở hữu kho Topping data truy cập TikTok, Facebook, YouTube... không giới hạn dung lượng, đồng giá 10K. - Ngập tràn voucher ưu đãi ""đủ wow"". Nhanh tay soạn GIC gửi 195 để gia nhập Vũ trụ số GIC - chân ái cho giới trẻ! LH 198 (0đ). Từ chối QC, soạn TC4 gửi 199.",0,0,0,brandname,Quảng cáo hợp lệ,NONE,real,real_label_0,data/ground_truth/dataset_label_0_with_categories.csv,1908
phase1_01905,"[QC] Khám phá Hành trình số ngay hôm nay để chinh phục các thử thách của chương trình và săn hàng loạt voucher từ các thương hiệu Grab, Shopee, Golden Gate... Tham gia tại https://viettel.vn/Hanhtrinhso. Chi tiết LH 198 (0đ). Từ chối QC, soạn TC3 gửi 199.",0,1,0,brandname,Quảng cáo hợp lệ,NONE,real,real_label_0,data/ground_truth/dataset_label_0_with_categories.csv,1909
phase1_01906,"Quý khách đã đăng ký thành công gói KS8: 8.000đ có 1,2GB sử dụng đến 23:59:59 ngày 04/11/2025. Truy cập https://viettel.vn/kttk để kiểm tra ưu đãi. Soạn HUY KS8 gửi 191 để hủy gói cước. Chi tiết LH 198 (0đ). Trân trọng.",0,1,0,shortcode,Viễn thông,NONE,real,real_label_0,data/ground_truth/dataset_label_0_with_categories.csv,1910
phase1_01907,"Tai khoan cua Quy khach sap het, soan UT hoac Y gui 9778 (trong vong 48h) de duoc cong 15.000d, su dung trong 48 gio tu DV Fast Airtime. Tai khoan cong se duoc tru khi Quy khach nap the. Tai khoan cong chua su dung het se bi huy khi het thoi gian su dung (Tai khoan cong chi su dung goi, nhan tin noi mang va ngoai mang). Tu choi nhan tin nhan, soan TC gui 9778. Chi tiet LH 18008098 (mien phi).",0,0,1,shortcode,Viễn thông,NONE,real,real_label_0,data/ground_truth/dataset_label_0_with_categories.csv,1911
phase1_01908,"Tai khoan cua Quy khach sap het. Soan UT hoac Y gui 9118 de xac nhan cong 25000d vao tai khoan (cuoc DV 3750d). De cong muc thap hon, soan UTx gui 9118 (x la boi so cua 5) hoac bam 1588sodienthoai de yeu cau nguoi nghe la thue bao Viettel tra phi cuoc goi. Chi tiet soan HD gui 9118 hoac LH 18008098 (0d). Xin cam on.",0,0,1,shortcode,Viễn thông,NONE,real,real_label_0,data/ground_truth/dataset_label_0_with_categories.csv,1912
phase1_01909,[TB] DATA CHO MỖI CHUYẾN ĐI! 1. Soạn ST7K gửi 191: 7K có 1GB sử dụng đến 24h ngày đăng ký 2. Soạn 5G30 gửi 191: 30K/3 ngày có 7GB/ngày Các gói cước gia hạn khi hết chu kỳ. Chi tiết LH 198 (0đ).,0,0,0,brandname,Viễn thông,NONE,real,real_label_0,data/ground_truth/dataset_label_0_with_categories.csv,1913
