sample_id,content,label,has_url,has_phone_number,sender_type,category,obfuscation_level,data_origin,source_dataset,source_file,source_row_id
phase1_00001,Hương đang làm gì vậy? Dạo này công việc thế nào rồi?,0,0,0,personal_number,Cá nhân & OTP,NONE,real,real_label_0,data/ground_truth/dataset_label_0_with_categories.csv,0
phase1_00002,"Linh ơi anh Tuấn nè, hôm nay vô tình gặp chị Mai nên xin được số em",0,0,0,personal_number,Cá nhân & OTP,NONE,real,real_label_0,data/ground_truth/dataset_label_0_with_categories.csv,1
phase1_00003,"Thảo dạo này khoẻ không, công việc ổn chứ ?",0,0,0,personal_number,Cá nhân & OTP,NONE,real,real_label_0,data/ground_truth/dataset_label_0_with_categories.csv,2
phase1_00004,Chào Phương! Bạn và gia đình dạo này khoẻ chứ?,0,0,0,personal_number,Cá nhân & OTP,NONE,real,real_label_0,data/ground_truth/dataset_label_0_with_categories.csv,3
phase1_00005,Chào Hùng. Lâu rồi không gặp. dạo này công việc vẫn ổn chứ,0,0,0,personal_number,Cá nhân & OTP,NONE,real,real_label_0,data/ground_truth/dataset_label_0_with_categories.csv,4
phase1_00006,Em Hà day. Goi lai vao so 0978123456 em co viec gap.,0,0,1,personal_number,Cá nhân & OTP,NONE,real,real_label_0,data/ground_truth/dataset_label_0_with_categories.csv,5
phase1_00007,[VIENDONG] MA otp dang nhap cua ban la 7GJ9VI .Vui long khong chia se cho nguoi khac. - viendongjsc.vn,0,1,0,brandname,Cá nhân & OTP,NONE,real,real_label_0,data/ground_truth/dataset_label_0_with_categories.csv,6
phase1_00008,"[CANH BAO] Ai do dang co truy cap tai khoan VPBank Online cua quy khach tren thiet bi/trinh duyet la. Neu khong phai QK, DOI MAT KHAU de tranh bi MAT TIEN. Neu la QK, nhap ma bao mat 534367 de tiep tuc. KHONG chia se ma nay cho bat ky ai BAO GOM NGAN HANG hay website gia mao de tranh rui ro MAT TIEN. LH 1900545415",0,0,1,brandname,Ngân hàng thật,NONE,real,real_label_0,data/ground_truth/dataset_label_0_with_categories.csv,7
phase1_00009,"Vietcombank KHONG yeu cau cung cap TEN DANG NHAP, MAT KHAU, OTP qua cac duong link gui qua SMS. Quy khach hay canh giac va TUYET DOI KHONG cung cap thong tin.",0,0,0,brandname,Ngân hàng thật,NONE,real,real_label_0,data/ground_truth/dataset_label_0_with_categories.csv,8
phase1_00010,"Xin Quý khách hãy lưu ý, Vietcombank KHÔNG gửi tin nhắn SMS đi kèm các đường link đăng nhập dịch vụ VCB Digibank. Các tin nhắn có đường link đăng nhập dịch vụ ĐỀU LÀ GIẢ MẠO. Quý khách tuyệt đối KHÔNG BẤM vào đường link nếu nhận được tin nhắn có nội dung nêu trên. Vui lòng tham khảo thêm thông tin tại đây: bit.ly/smsmaodanh",0,1,0,personal_number,Ngân hàng thật,NONE,real,real_label_0,data/ground_truth/dataset_label_0_with_categories.csv,9
phase1_00011,Ma OTP la 22085377. de xac nhan giao dich (TRU TIEN) tu The cua quy khach. Vui long giu bao mat va khong chia se OTP cho bat cu ai. LH Techcombank: 1800588822,0,0,1,brandname,Ngân hàng thật,NONE,real,real_label_0,data/ground_truth/dataset_label_0_with_categories.csv,10
phase1_00012,"THÔNG BÁO! Hiện nay đang có số điện thoại lạ gọi đến các công dân trên địa bàn, xưng danh là ở phòng Văn hoá Xã hội phường để đề nghị vào đường link của bảo hiểm xã hội VSSID để đổi thẻ Bảo hiểm. Đây là số điện thoại mạo danh để lừa đảo công nghệ cao qua mạng. Kính đề nghị các đ/c lãnh đạo Tổ dân phố gửi ngay thông tin này tới bà con nhân dân không thực hiện theo hướng dẫn của tội phạm. Cơ quan Bảo hiểm Xã hội và phòng VHXH phường không triển khai nội dung này. Trân trọng!",0,0,0,personal_number,Dịch vụ công thật,NONE,real,real_label_0,data/ground_truth/dataset_label_0_with_categories.csv,11
phase1_00013,"CHÚC MỪNG SINH NHẬT Quý khách. Kính chúc Quý khách luôn hạnh phúc, thành công và thịnh vượng. Cảm ơn Quý khách đã luôn đồng hành cùng fpt-voice.net",0,1,0,personal_number,Khác,NONE,real,real_label_0,data/ground_truth/dataset_label_0_with_categories.csv,12
phase1_00014,"TB: Tu 10/6/17, QK vui long su dung TK DDA 104005886693 gan voi the ATM E-Partner thay cho TK 711A50424587 voi so du duoc giu nguyen. Cam on QK. LH 1900558868",0,0,1,brandname,Ngân hàng thật,NONE,real,real_label_0,data/ground_truth/dataset_label_0_with_categories.csv,13
phase1_00015,"Viettel kinh chuc Quy khach ngay sinh nhat vui ve, dam am ben nguoi than va gia dinh. Tran trong cam on Quy khach da su dung dich vu cua Viettel.",0,0,0,brandname,Khác,NONE,real,real_label_0,data/ground_truth/dataset_label_0_with_categories.csv,14
phase1_00016,Chuc Quy khach ngay le 20/10 vui ve ben nguoi than va gia dinh.,0,0,0,brandname,Khác,NONE,real,real_label_0,data/ground_truth/dataset_label_0_with_categories.csv,15
phase1_00017,"Ma OTP xac thuc GD la 972501, hieu luc 1 phut. Chi tiet GD:Chuyen khoan nhanh qua so TK,so tien 22,700,000 VND tren kenh Internet cua dich vu VCB Digibank.",0,0,0,brandname,Ngân hàng thật,NONE,real,real_label_0,data/ground_truth/dataset_label_0_with_categories.csv,16
phase1_00018,"SME Viet Nam: Toa dam von cho SME VN va Ra mat Mang luoi ket noi, ho tro doanh nghiep SME VN se dien ra luc 9h-12h30 ngay 21/10/2017, tai Diamond Place, 15A Ho Van Hue, P9, Q.Phu Nhuan",0,0,0,personal_number,Khác,NONE,real,real_label_0,data/ground_truth/dataset_label_0_with_categories.csv,17
phase1_00019,"PCGV tran trong thong bao ke tu thang 07/2017 se khong thu tien tai nha, moi Quy KH thanh toan tien dien qua Ngan hang hoac cac diem thu ho. LH 1900545454",0,0,1,brandname,Dịch vụ công thật,NONE,real,real_label_0,data/ground_truth/dataset_label_0_with_categories.csv,18
phase1_00020,"Quý khách vừa đăng ký thành công gói cước WIN60 với ưu đãi: Data tốc độ cao không giời hạn + 05GB Hotspot dùng trên thiết bị Smartphone / Tablet, sử dụng đến 04/09/2023. Thời gian cam kết sử dụng mạng Wintel là 24 tháng kế từ ngày đăng ký gói cước thành công. Trân trọng!",0,0,0,brandname,Viễn thông,NONE,real,real_label_0,data/ground_truth/dataset_label_0_with_categories.csv,19
phase1_00021,Xem ngay tuyen tap 30 pha kien tao tuyen dinh trong bong da tai http://mobiclip.vn/2198/playlist/html hoan toan MIEN CUOC 3G/GPRS. Tran trong cam on,0,1,0,brandname,Quảng cáo hợp lệ,NONE,real,real_label_0,data/ground_truth/dataset_label_0_with_categories.csv,20
phase1_00022,"(QC) Dich vu Tong Dai Taxi Viettel: Goi 1520 de duoc ket noi den hang Taxi uy tin gan nhat voi vi tri hien tai cua Quy khach. Cuoc phi chi 1500d/p. Chi tiet: 198 (100d/p). Tu choi QC, soan TC4 gui 199.",0,0,0,shortcode,Quảng cáo hợp lệ,NONE,real,real_label_0,data/ground_truth/dataset_label_0_with_categories.csv,21
phase1_00023,"iTel TB: Den het thang 01/2023, Quy khach dang la hoi vien Than Thiet, so diem iTel Club la 200. Diem iTel Club co gia tri su dung trong vong 12 thang ke tu thang kich hoat. Dung lang phi diem nhe! Truy cap app MyiTel tai http://onelink.to/myitel hoac website itel.vn/club de nhan va su dung nhieu uu dai hap dan tu iTel Club. Chi tiet LH 0877087087 (0d cho TB iTel). Tran trong!",0,1,1,brandname,Viễn thông,NONE,real,real_label_0,data/ground_truth/dataset_label_0_with_categories.csv,22
phase1_00024,Tel chân thành xin lỗi Quý Khách về sự cố gián đoạn dịch vụ chiều ngày 03/02/2023. Hiện các dịch vụ đã hoạt động bình thường trở lại. Rất mong nhận được sự thông cảm của Quý Khách. Mọi yêu cầu hỗ trợ vui lòng liên hệ CSKH iTel: gọi 0877087087 (0đ cho TB iTel). Trân trọng!,0,0,1,brandname,Viễn thông,NONE,real,real_label_0,data/ground_truth/dataset_label_0_with_categories.csv,23
phase1_00025,"SHOPEE: DE CAP NHAT MAT KHAU, ma xac minh la 131929. Co hieu luc trong 15 phut. KHONG chia se ma nay voi nguoi khac, ke ca nhan vien Shopee.",0,0,0,personal_number,Cá nhân & OTP,NONE,real,real_label_0,data/ground_truth/dataset_label_0_with_categories.csv,24
phase1_00026,Use code 55167 to add this phone to your Steam account,0,0,0,personal_number,Cá nhân & OTP,NONE,real,real_label_0,data/ground_truth/dataset_label_0_with_categories.csv,25
phase1_00027,"""Thông tin minh bạch - Tiêu dùng an toàn"" là chủ đề Ngày Quyền của người tiêu dùng Việt Nam 2023",0,0,0,personal_number,Khác,NONE,real,real_label_0,data/ground_truth/dataset_label_0_with_categories.csv,26
phase1_00028,"(TB) Bộ TT&TT trân trọng đề nghị người dân cảnh giác với thông tin giả mạo, lừa đảo trên Internet. Trước khi sử dụng dịch vụ, giao dịch trên Internet, hãy tra cứu thông tin về website mà mình truy cập bằng cách nhắn tin miễn phí theo cú pháp TCTM <tên miền hoặc link website> gửi 156 hoặc tra cứu tại: https://tracuutenmien.gov.vn",0,1,0,personal_number,Dịch vụ công thật,NONE,real,real_label_0,data/ground_truth/dataset_label_0_with_categories.csv,27
phase1_00029,"[CANH BAO] Ai do dang co truy cap tai khoan VPBank Online cua quy khach tren thiet bi/trinh duyet la. Neu khong phai QK, DOI MAT KHAU de tranh bi MAT TIỀN. Neu la QK, nhap ma bao mat 534367 de tiep tục. KHÔNG chia se ma nay cho bat kỳ ai BAO GỒM NGAN HANG hay website gia mao de tranh rui ro MAT TIEN. LH 1900545415",0,0,1,brandname,Ngân hàng thật,NONE,real,real_label_0,data/ground_truth/dataset_label_0_with_categories.csv,28
phase1_00030,"[TB] NẠP THẺ ĐỦ ĐẦY - DATA XÀI NGAY! Tặng 20% giá trị tất cả thẻ nạp vào tài khoản viễn thông trong ngày 25/11/2025. Tiền KM sử dụng truy cập Internet trong 15 ngày. Nạp thẻ online tại các ví điện tử, ứng dụng thanh toán hoặc tại https://viettel.vn/naptienkm . Chi tiết gọi 197 bấm phím 19 (0đ). Trân trọng.",0,1,0,brandname,Viễn thông,NONE,real,real_label_0,data/ground_truth/dataset_label_0_with_categories.csv,29
phase1_00031,"[TB] NÂNG CẤP ĐIỆN THOẠI - NHẬN ƯU ĐÃI 5G. Tặng 15GB data trải nghiệm trên hạ tầng 5G trong 15 ngày (1GB/ngày) khi Quý khách nâng cấp lên điện thoại 5G. Để nhận ưu đãi, sử dụng máy 5G và soạn 5G gửi 191. Chương trình áp dụng 1 lần đến hết ngày 30/11/2025, dành riêng cho Quý khách. Chi tiết LH 198 (0đ).",0,0,0,brandname,Viễn thông,NONE,real,real_label_0,data/ground_truth/dataset_label_0_with_categories.csv,30
phase1_00032,"[TB] NẠP THẺ ONLINE - DATA XÀI NGAY! Tặng 20% giá trị tất cả thẻ nạp vào tài khoản viễn thông trong ngày 15/11/2025. Tiền KM sử dụng truy cập Internet trong 15 ngày. CT áp dụng khi nạp thẻ online qua các ví điện tử, ứng dụng thanh toán hoặc tại https://viettel.vn/pay/tt . Chi tiết gọi 197, bấm phím 19 (0đ). Trân trọng.",0,1,0,brandname,Viễn thông,NONE,real,real_label_0,data/ground_truth/dataset_label_0_with_categories.csv,31
phase1_00033,"[TB] NẠP THẺ ĐỦ ĐẦY - DATA XÀI NGAY! Tặng 20% giá trị tất cả thẻ nạp vào tài khoản viễn thông trong ngày 10/11/2025. Tiền KM sử dụng truy cập Internet trong 15 ngày. Nạp thẻ online tại các ví điện tử, ứng dụng thanh toán hoặc tại https://viettel.vn/naptienkm . Chi tiết gọi 197 bấm phím 19 (0đ). Trân trọng.",0,1,0,brandname,Viễn thông,NONE,real,real_label_0,data/ground_truth/dataset_label_0_with_categories.csv,32
phase1_00034,"[TB] LÊN MẠNG, GỌI ĐIỆN THẢ GA! 1. Soạn V90B gửi 191: 90K/30 ngày có 30GB (1GB/ngày), 30p gọi ngoại mạng, miễn phí 10p/cuộc gọi nội mạng 2. Soạn SD70 gửi 191: 70K/30 ngày có 30GB (1GB/ngày) Gói cước gia hạn sau 30 ngày. CT dành riêng cho Quý khách. LH 198 (0đ).",0,0,0,brandname,Viễn thông,NONE,real,real_label_0,data/ground_truth/dataset_label_0_with_categories.csv,33
phase1_00035,"Ban co the qua NAP DIEN THOAI MIEN PHI 10.000D trong MoMo, het han 31/10. Mo Vi > UU DAI > QUA CUA TOI dung ngay!",0,0,0,brandname,Khác,NONE,real,real_label_0,data/ground_truth/dataset_label_0_with_categories.csv,34
phase1_00036,"Ban co 10.000D qua Nap Dien Thoai & 140.000D qua khac trong MoMo, het han 31/10. Mo Vi > UU DAI > QUA CUA TOI dung ngay!",0,0,0,brandname,Khác,NONE,real,real_label_0,data/ground_truth/dataset_label_0_with_categories.csv,35
phase1_00037,"[TB] Nap lien tay, Khuyen mai ngay. Tang 30% gia tri tat ca the nap trong ngay 29/10/2025 (20% de truy cap Internet, 10% de goi va nhan tin noi mang), uu dai su dung trong 15 ngay. CT danh rieng cho Quy khach khi nap the online tai cac vi dien tu, ung dung thanh toan hoac tai https://viettel.vn/naptienkm . LH 198 (0d).",0,1,0,brandname,Viễn thông,NONE,real,real_label_0,data/ground_truth/dataset_label_0_with_categories.csv,36
phase1_00038,"[TB] Nạp liền tay, Khuyến mại ngay. Tặng 30% giá trị tất cả thẻ nạp vào tài khoản viễn thông trong ngày hôm nay (20% để truy cập Internet, 10% để gọi và nhắn tin nội mạng), ưu đãi sử dụng trong 15 ngày. CT dành riêng cho Quý khách khi nạp thẻ online tại các ví điện tử, ứng dụng thanh toán hoặc tại https://viettel.vn/naptienkm . LH 198 (0đ).",0,1,0,brandname,Viễn thông,NONE,real,real_label_0,data/ground_truth/dataset_label_0_with_categories.csv,37
phase1_00039,"[TB] NẠP THẺ ĐỦ ĐẦY - DATA XÀI NGAY! Tặng 20% giá trị tất cả thẻ nạp vào tài khoản viễn thông trong ngày 25/10/2025. Tiền KM sử dụng truy cập Internet trong 15 ngày. Nạp thẻ online tại các ví điện tử, ứng dụng thanh toán hoặc tại https://viettel.vn/naptienkm . Chi tiết gọi 197 bấm phím 19 (0đ). Trân trọng.",0,1,0,brandname,Viễn thông,NONE,real,real_label_0,data/ground_truth/dataset_label_0_with_categories.csv,38
phase1_00040,"[TB] Chỉ với 3K - Cần chi wifi! 1. Soạn 5G10 gửi 191: 3.000đ (giá gốc 10.000đ) có 6GB. 2. Soạn ST7K gửi 191: 3.000đ (giá gốc 7.000đ) có 1GB. Ưu đãi sử dụng đến 24h ngày đăng ký, các gói cước gia hạn theo ngày với giá gốc. CT áp dụng với lần đăng ký đầu tiên đến 30/10 cho TB nhận được tin nhắn. LH 198 (0đ).",0,0,0,shortcode,Viễn thông,NONE,real,real_label_0,data/ground_truth/dataset_label_0_with_categories.csv,39
phase1_00041,"[QC] Cơ hội TRÚNG XE MÁY HONDA SH 125i PHIÊN BẢN THỂ THAO khi hòa mạng Internet Viettel và đóng trước cước từ 6 tháng trở lên, cước thuê bao chỉ từ 220.000đ/tháng. LH 18008168 (0đ) để được tư vấn gói cước và phí hòa mạng. CT áp dụng từ 1/10 - 31/12/2025 tại TP. Hồ Chí Minh. Từ chối QC, soạn TC3 gửi 199.",0,0,1,brandname,Quảng cáo hợp lệ,NONE,real,real_label_0,data/ground_truth/dataset_label_0_with_categories.csv,40
phase1_00042,"[TB] Nap lien tay, Khuyen mai ngay. Tang 30% gia tri tat ca the nap trong ngay 22/10/2025 (20% de truy cap Internet, 10% de goi va nhan tin noi mang), uu dai su dung trong 15 ngay. CT danh rieng cho Quy khach khi nap the online tai cac vi dien tu, ung dung thanh toan hoac tai https://viettel.vn/naptienkm . LH 198 (0d).",0,1,0,brandname,Viễn thông,NONE,real,real_label_0,data/ground_truth/dataset_label_0_with_categories.csv,41
phase1_00043,[TB] MTTQ Việt Nam kêu gọi chung tay ủng hộ đồng bào bị thiệt hại do bão lũ gây ra. Các tài khoản tiếp nhận: 55102025 tại Vietinbank; 8639699999 tại BIDV; 1400666102025 tại Agribank; 8888881010 tại Vietcombank; 0606 tại MBbank.,0,0,0,brandname,Viễn thông,NONE,real,real_label_0,data/ground_truth/dataset_label_0_with_categories.csv,42
phase1_00044,"[TB] Mừng 25 năm Viettel Telecom - Cảm ơn Quý khách đã lựa chọn và đồng hành! Để nhận ưu đãi data và điểm Viettel++ tương ứng với số năm Quý khách đã gắn bó cùng Viettel, truy cập https://vietteltelecom25.tv360.vn ngay trong ngày 15/10/2025. Chi tiết LH 198 (0đ). Trân trọng!",0,1,0,brandname,Viễn thông,NONE,real,real_label_0,data/ground_truth/dataset_label_0_with_categories.csv,43
phase1_00045,"[TB] Nap lien tay, Khuyen mai ngay. Tang 30% gia tri tat ca the nap trong ngay 29/09/2025 (20% de truy cap Internet, 10% de goi va nhan tin noi mang), uu dai su dung trong 15 ngay. CT danh rieng cho Quy khach khi nap the online tai cac vi dien tu, ung dung thanh toan hoac tai https://viettel.vn/naptienkm . LH 198 (0d).",0,1,0,brandname,Viễn thông,NONE,real,real_label_0,data/ground_truth/dataset_label_0_with_categories.csv,44
phase1_00046,"Ban co 10.000D qua Nap Dien Thoai & 140.000D qua khac trong MoMo, het han 30/9. Mo Vi > UU DAI > QUA CUA TOI dung ngay!",0,0,0,brandname,Khác,NONE,real,real_label_0,data/ground_truth/dataset_label_0_with_categories.csv,45
phase1_00047,"Ban co the qua NAP DIEN THOAI MIEN PHI 10.000D trong MoMo, het han 30/9. Mo Vi > UU DAI > QUA CUA TOI dung ngay!",0,0,0,brandname,Khác,NONE,real,real_label_0,data/ground_truth/dataset_label_0_with_categories.csv,46
phase1_00048,"[TB] NẠP THẺ ĐỦ ĐẦY - DATA XÀI NGAY! Tặng 20% giá trị tất cả thẻ nạp vào tài khoản viễn thông trong ngày 25/09/2025. Tiền KM sử dụng truy cập Internet trong 15 ngày. Nạp thẻ online tại các ví điện tử, ứng dụng thanh toán hoặc tại https://viettel.vn/naptienkm . Chi tiết gọi 198 bấm phím 1 (0đ). Trân trọng.",0,1,0,brandname,Viễn thông,NONE,real,real_label_0,data/ground_truth/dataset_label_0_with_categories.csv,47
phase1_00049,"[TB] Chỉ với 3K - Cần chi wifi! 1. Soạn 5G10 gửi 191: 3.000đ (giá gốc 10.000đ) có 6GB. 2. Soạn ST7K gửi 191: 3.000đ (giá gốc 7.000đ) có 1GB. Ưu đãi sử dụng đến 24h ngày đăng ký, các gói cước gia hạn theo ngày với giá gốc. CT áp dụng với lần đăng ký đầu tiên đến 30/09 cho TB nhận được tin nhắn. LH 198 (0đ).",0,0,0,shortcode,Viễn thông,NONE,real,real_label_0,data/ground_truth/dataset_label_0_with_categories.csv,48
phase1_00050,"[TB] Nap lien tay, Khuyen mai ngay. Tang 30% gia tri tat ca the nap trong ngay 23/09/2025 (20% de truy cap Internet, 10% de goi va nhan tin noi mang), uu dai su dung trong 15 ngay. CT danh rieng cho Quy khach khi nap the online tai cac vi dien tu, ung dung thanh toan hoac tai https://viettel.vn/naptienkm . LH 198 (0d).",0,1,0,brandname,Viễn thông,NONE,real,real_label_0,data/ground_truth/dataset_label_0_with_categories.csv,49
phase1_00051,"[TB] Nap lien tay, Khuyen mai ngay. Tang 30% gia tri tat ca the nap trong ngay 18/09/2025 (20% de truy cap Internet, 10% de goi va nhan tin noi mang), uu dai su dung trong 15 ngay. CT danh rieng cho Quy khach khi nap the online tai cac vi dien tu, ung dung thanh toan hoac tai https://viettel.vn/naptienkm . LH 198 (0d).",0,1,0,brandname,Viễn thông,NONE,real,real_label_0,data/ground_truth/dataset_label_0_with_categories.csv,50
phase1_00052,[TB] MUA SỚM - GIÁ CHỈ CÒN 1 NỬA! 1. Soạn 5G10 gửi 191: 5.000đ (giá gốc 10.000đ) có 6GB sử dụng đến 24h ngày đăng ký. 2. Soạn 5G30 gửi 191: 15.000đ/3 ngày (giá gốc 30.000đ) có 21GB (7GB/ngày). Các gói cước gia hạn với giá gốc khi hết chu kỳ. CT áp dụng với lần đăng ký đầu tiên trước 24/09 cho TB nhận được tin nhắn. LH 198 (0đ).,0,0,0,brandname,Viễn thông,NONE,real,real_label_0,data/ground_truth/dataset_label_0_with_categories.csv,51
phase1_00053,"[TB] NẠP THẺ ONLINE - DATA XÀI NGAY! Tặng 20% giá trị tất cả thẻ nạp vào tài khoản viễn thông trong ngày 15/09/2025. Tiền KM sử dụng TRUY CẬP INTERNET trong 15 ngày. CT áp dụng khi nạp thẻ online qua các ví điện tử, ứng dụng thanh toán hoặc tại https://viettel.vn/pay/tt . Chi tiết gọi 198, bấm phím 2 (0đ). Trân trọng.",0,1,0,brandname,Viễn thông,NONE,real,real_label_0,data/ground_truth/dataset_label_0_with_categories.csv,52
phase1_00054,"Tai khoan cua thue bao hien khong du de thuc hien nhan tin, Quy khach nap them tien de tiep tuc su dung dich vu. Chi tiet LH 198 (0d). Tran trong.",0,0,0,shortcode,Viễn thông,NONE,real,real_label_0,data/ground_truth/dataset_label_0_with_categories.csv,53
phase1_00055,"DHCNTT TB HOC PHI DOT 1 HK1 25-26 CUA SV Nguyen Hoang Duy (22520327) LA 18,500,000d, HAN NOP HP DOT 1 LA 28/9/2025. VUI LONG BO QUA TIN NHAN NEU DA NOP TIEN.",0,0,0,brandname,Khác,NONE,real,real_label_0,data/ground_truth/dataset_label_0_with_categories.csv,54
phase1_00056,"[TB] Nạp liền tay, Khuyến mại ngay. Tặng 20% giá trị tất cả thẻ nạp vào tài khoản viễn thông trong ngày hôm nay. Tiền KM sử dụng truy cập Internet trong 15 ngày. Nạp thẻ online tại các ví điện tử, ứng dụng thanh toán hoặc tại https://viettel.vn/naptienkm . CT áp dụng cho thuê bao nhận được tin nhắn. LH 198 (0đ).",0,1,0,brandname,Viễn thông,NONE,real,real_label_0,data/ground_truth/dataset_label_0_with_categories.csv,55
phase1_00057,"[TB] Mung ngay Quoc khanh Viet Nam 2/9, lien ket so dien thoai Viettel Money voi VNeID ngay hom nay de nhan tien An sinh xa hoi tu Chinh Phu vao tai khoan. Neu da lien ket vui long bo qua. Chi tiet xem tai https://viettelmoney.go.link/lienketVNeID . Lien he 18009000 (0d). Tran trong!",0,1,1,brandname,Viễn thông,NONE,real,real_label_0,data/ground_truth/dataset_label_0_with_categories.csv,56
phase1_00058,"[QC] Xem trực tiếp Lễ diễu binh, diễu hành cấp Quốc gia trên TV360 tại http://s.viettel.vn/80namquockhanh vào 6h30 ngày 2/9. Hãy cùng hòa mình vào không khí kỷ niệm 80 năm ngày Quốc khánh Việt Nam. Chi tiết LH 18008119 (0đ). Từ chối QC, soạn TC4 gửi 199.",0,1,1,brandname,Quảng cáo hợp lệ,NONE,real,real_label_0,data/ground_truth/dataset_label_0_with_categories.csv,57
phase1_00059,"[TB] 2/9 - KẾT NỐI TRỌN NIỀM VUI. Tặng 29% giá trị tất cả thẻ nạp trong ngày 2/9 vào tài khoản viễn thông. Tiền KM sử dụng truy cập Internet trong 15 ngày. Nạp thẻ online tại các ví điện tử, ứng dụng thanh toán hoặc tại https://viettel.vn/naptienkm . Chi tiết gọi 198 bấm phím 2 (0đ). Trân trọng.",0,1,0,brandname,Viễn thông,NONE,real,real_label_0,data/ground_truth/dataset_label_0_with_categories.csv,58
phase1_00060,"[QC] 1 cham giai ngan den 35 TRIEU dong, chi can CCCD. Dang ky Vay nhanh Mcredit voi Viettel Money: https://viettelmoney.go.link/Ngdub .Chi tiet LH 18009000 (0d). Tu choi QC, soan TC3 gui 199.",0,1,1,brandname,Quảng cáo hợp lệ,NONE,real,real_label_0,data/ground_truth/dataset_label_0_with_categories.csv,59
phase1_00061,"Theo Nghi dinh 119/2024/ND-CP cua Chinh phu, de nghi chu phuong tien o to thuc hien thu tuc chuyen doi tai khoan thu phi sang tai khoan giao thong ket noi voi phuong tien thanh toan khong dung tien mat truoc ngay 01/10/2025. Chu phuong tien lien he voi ePass hoac Nha cung cap dich vu thu phi khac de duoc huong dan thuc hien, tranh gay gian doan dich vu. Neu da lien ket vui long bo qua. Truy cap https://giaothongso.viettelmoney.vn/nd119/ de biet them thong tin.",0,1,0,brandname,Viễn thông,NONE,real,real_label_0,data/ground_truth/dataset_label_0_with_categories.csv,60
phase1_00062,"[TB] Nap lien tay, Khuyen mai ngay. Tang 30% gia tri tat ca the nap trong ngay 28/08/2025 (20% de truy cap Internet, 10% de goi va nhan tin noi mang), uu dai su dung trong 15 ngay. CT danh rieng cho Quy khach khi nap the online tai cac vi dien tu, ung dung thanh toan hoac tai https://viettel.vn/naptienkm . LH 198 (0d).",0,1,0,brandname,Viễn thông,NONE,real,real_label_0,data/ground_truth/dataset_label_0_with_categories.csv,61
phase1_00063,"Truong Dai hoc CNTT thong bao diem HK 2 NH 2024-2025 cua SV Nguyen Hoang Duy (22520327):IE105 6.7,IE212 8.1,IE303 7.3,DS200 8.3, diem co the thay doi neu SV co phuc khao diem.",0,0,0,brandname,Khác,NONE,real,real_label_0,data/ground_truth/dataset_label_0_with_categories.csv,62
phase1_00064,"[TB] Chỉ với 3K - Cần chi wifi! 1. Soạn 5G10 gửi 191: 3.000đ (giá gốc 10.000đ) có 6GB. 2. Soạn ST7K gửi 191: 3.000đ (giá gốc 7.000đ) có 1GB. Ưu đãi sử dụng đến 24h ngày đăng ký, các gói cước gia hạn theo ngày với giá gốc. CT áp dụng với lần đăng ký đầu tiên đến 30/08 cho TB nhận được tin nhắn. LH 198 (0đ).",0,0,0,shortcode,Viễn thông,NONE,real,real_label_0,data/ground_truth/dataset_label_0_with_categories.csv,63
phase1_00065,"[TB] Nap lien tay, Khuyen mai ngay. Tang 30% gia tri tat ca the nap trong ngay 21/08/2025 (20% de truy cap Internet, 10% de goi va nhan tin noi mang), uu dai su dung trong 15 ngay. CT danh rieng cho Quy khach khi nap the online tai cac vi dien tu, ung dung thanh toan hoac tai https://viettel.vn/naptienkm . LH 198 (0d).",0,1,0,brandname,Viễn thông,NONE,real,real_label_0,data/ground_truth/dataset_label_0_with_categories.csv,64
phase1_00066,[TB] MUA SỚM - GIÁ CHỈ CÒN 1 NỬA! Soạn 5G10 gửi 191: 5.000đ/ngày (giá gốc 10.000đ) có 6GB sử dụng đến 24h ngày đăng ký. Gói cước gia hạn theo ngày với giá gốc. CT áp dụng với lần đăng ký đầu tiên trước 24/08 cho TB nhận được tin nhắn. LH 198 (0đ).,0,0,0,shortcode,Viễn thông,NONE,real,real_label_0,data/ground_truth/dataset_label_0_with_categories.csv,65
