sample_id,content,label,has_url,has_phone_number,sender_type,category,obfuscation_level,data_origin,source_dataset,source_file,source_row_id
phase1_01258,"Truong DH CNTT thong bao hoc bu mon Cong nghe Du lieu lon(IE212.P22) vao thu 7 ngay 24/05/2025, Tiet 1,2,3,4,5, Phong B1.12. Chi tiet vui long lien he (028) 372 52002 chon 155",0,0,0,brandname,Khác,NONE,real,real_label_0,data/ground_truth/dataset_label_0_with_categories.csv,1260
phase1_01259,"Truong DH CNTT thong bao hoc bu mon Cong nghe Du lieu lon(IE212.P22) vao thu 5 ngay 22/05/2025, Tiet 1,2,3,4, Phong C314. Chi tiet vui long lien he (028) 372 52002 chon 155",0,0,0,brandname,Khác,NONE,real,real_label_0,data/ground_truth/dataset_label_0_with_categories.csv,1261
phase1_01260,"Truong DH CNTT thong bao hoc bu mon Phan tich du lieu lon(DS200.P21) vao thu 3 ngay 20/05/2025, Tiet 1,2,3,4, Phong B4.20. Chi tiet vui long lien he (028) 372 52002 chon 155",0,0,0,brandname,Khác,NONE,real,real_label_0,data/ground_truth/dataset_label_0_with_categories.csv,1262
phase1_01261,"Truong DH CNTT thong bao hoc bu mon Cong nghe Du lieu lon(IE212.P22.1) vao thu 6 ngay 16/05/2025, Tiet 6,7,8,9,10, Phong B2.14. Chi tiet vui long lien he (028) 372 52002 chon 155",0,0,0,brandname,Khác,NONE,real,real_label_0,data/ground_truth/dataset_label_0_with_categories.csv,1263
phase1_01262,(TB) Nhanh tay nạp tiền – Nhận liền 50% khi Quý khách nạp bằng hình thức trực tiếp DUY NHẤT tại ứng dụng My VNPT (https://my.vnpt.com.vn/adv/napdt ) trong HÔM NAY 11/5/2025. Khuyến mãi được sử dụng gọi và nhắn tin trong 15 ngày. CSKH:18001091 (0đ).,0,1,1,brandname,Viễn thông,NONE,real,real_label_0,data/ground_truth/dataset_label_0_with_categories.csv,1264
phase1_01263,"(TB) Chủ Nhật Độc Quyền ngập tràn ưu đãi! My VNPT tặng bạn thêm 50% khi Nạp điện thoại VinaPhone cho thuê bao trả trước (khuyến mại được sử dụng gọi/nhắn tin trong 15 ngày), duy nhất 11/05/2025. Áp dụng cho mọi mệnh giá, không giới hạn tại https://my.vnpt.com.vn/adv/napthe50. CSKH: 18001091 nhánh 3 (0đ). Trân trọng!",0,1,1,brandname,Viễn thông,NONE,real,real_label_0,data/ground_truth/dataset_label_0_with_categories.csv,1265
phase1_01264,"(TB) Đừng quên mai là Chủ Nhật Độc Quyền My VNPT! ƯU ĐÃI NẠP THẺ 50% đang đợi bạn, duy nhất 11/05/2025. Áp dụng cho thuê bao VinaPhone trả trước - khuyến mại dùng gọi/nhắn tin trong 15 ngày. Không giới hạn mệnh giá, số lần nạp. Đặt lịch tại https://my.vnpt.com.vn/adv/napthe50. CSKH: 18001091 nhánh 3 (0đ). Trân trọng!",0,1,1,brandname,Viễn thông,NONE,real,real_label_0,data/ground_truth/dataset_label_0_with_categories.csv,1266
phase1_01265,"[TB] Cảnh báo: Xuất hiện tình trạng tội phạm tạo lập các website, facebook giả mạo các trường đại học, trung tâm đào tạo quảng cáo, các khóa huấn luyện học kỳ, trại hè quân đội, công an…cho trẻ em nhằm tiếp cận phụ huynh có nhu cầu và dụ dỗ nạp tiền tham gia để chiếm đoạt tài sản. Khuyến cáo người dân: nâng cao cảnh giác, chỉ đăng ký tham gia và chuyển tiền khi đã tìm hiểu rõ thông tin của đơn vị tổ chức. Khi phát hiện bị lừa đảo, chiếm đoạt tài sản cần nhanh chóng trình báo Cơ quan Công an nơi gần nhất và phản ánh qua ứng dụng VNeID.",0,0,0,brandname,Dịch vụ công thật,NONE,real,real_label_0,data/ground_truth/dataset_label_0_with_categories.csv,1267
phase1_01266,"Truong DH CNTT thong bao hoc HT2 mon Nhap mon bao dam va an ninh thong tin(IE105.P22.1) vao thu 7 ngay 10/05/2025, Tiet 1,2,3,4,5, Phong B2.16. Chi tiet vui long lien he (028) 372 52002 chon 155",0,0,0,brandname,Khác,NONE,real,real_label_0,data/ground_truth/dataset_label_0_with_categories.csv,1268
phase1_01267,"(TB) MỪNG ĐẠI LỄ 50 NĂM, My VNPT dành tặng bạn ƯU ĐÃI 50% khi Nạp điện thoại VinaPhone cho thuê bao trả trước (khuyến mại được sử dụng gọi/nhắn tin trong 15 ngày) ngày 04/05/2025. Áp dụng cho mọi mệnh giá, không giới hạn tại https://my.vnpt.com.vn/adv/napthe50. CSKH: 18001091 nhánh 3 (0đ). Trân trọng!",0,1,1,brandname,Viễn thông,NONE,real,real_label_0,data/ground_truth/dataset_label_0_with_categories.csv,1269
phase1_01268,"(TB) Chớp ngay thời cơ – Đón ưu đãi khủng! Duy nhất HÔM NAY - 04/05/2025, Quý khách nhận ngay quà tặng 50% khi nạp tiền bằng hình thức trực tiếp trên ứng dụng My VNPT tại: https://my.vnpt.com.vn/adv/napdt . Khuyến mãi được sử dụng gọi và nhắn tin trong 15 ngày. CSKH:18001091 (0đ).",0,1,1,brandname,Viễn thông,NONE,real,real_label_0,data/ground_truth/dataset_label_0_with_categories.csv,1270
phase1_01269,"(TB) Đặt lịch nạp thẻ ngay hôm nay để nhận ƯU ĐÃI 50% mừng Đại lễ 50 năm, duy nhất ngày 04/05/2025 trên My VNPT! Áp dụng cho thuê bao VinaPhone trả trước - dùng gọi/nhắn tin trong 15 ngày. Không giới hạn mệnh giá, số lần nạp. Đặt lịch tại https://my.vnpt.com.vn/adv/napthe50. CSKH: 18001091 nhánh 3 (0đ). Trân trọng!",0,1,1,brandname,Viễn thông,NONE,real,real_label_0,data/ground_truth/dataset_label_0_with_categories.csv,1271
phase1_01270,(TB) TƯNG BỪNG MỪNG ĐẠI LỄ! VinaPhone tặng 20% giá trị thẻ nạp vào NGÀY MAI 01/5/2025. Khuyến mại được sử dụng gọi/nhắn tin trong 15 ngày. Thêm ưu đãi khi nạp tại: https://my.vnpt.com.vn/adv/napthe . CSKH: 18001091 (0đ).,0,1,1,brandname,Viễn thông,NONE,real,real_label_0,data/ground_truth/dataset_label_0_with_categories.csv,1272
phase1_01271,Quy khach co 0 MB dung luong khuyen mai tu VinaPhone,0,0,0,shortcode,Viễn thông,NONE,real,real_label_0,data/ground_truth/dataset_label_0_with_categories.csv,1273
phase1_01272,Goi cuoc D6V (6.000d/ngay) cua QK gia han khong thanh cong do tai khoan chinh khong du 6.000d. Vui long nap tien (toi thieu 6.000d) tai https://my.vnpt.com.vn/adv/napthe de duoc gia han va tiep tuc su dung uu dai cua goi cuoc. CSKH: 18001091 (0d).,0,1,1,shortcode,Viễn thông,NONE,real,real_label_0,data/ground_truth/dataset_label_0_with_categories.csv,1274
phase1_01273,Quy khach co 713 MB su dung den 14:49 25/04/2025 tu VinaPhone. CSKH 18001091.,0,0,1,shortcode,Viễn thông,NONE,real,real_label_0,data/ground_truth/dataset_label_0_with_categories.csv,1275
phase1_01274,"[UNG TIEN]Tai khoan chinh cua Quy khach sap het. Soan Y gui 1576 (hieu luc trong vong 48h - gia cuoc dich vu 2500d) de duoc ung 10000d vao tai khoan chinh. De duoc ung tien tu dong moi khi tai khoan chinh duoi 5.000d, soan UTD gui 1576. Tu choi nhan tin nhan, soan TC gui 1576. CSKH: 18001091 (0d)",0,0,1,shortcode,Viễn thông,NONE,real,real_label_0,data/ground_truth/dataset_label_0_with_categories.csv,1276
phase1_01275,"[UNG TIEN AIRTIME] Tai khoan chinh cua Quy khach sap het. Soan A gui 1357 de duoc ung 25000d, GIA CUOC 0 DONG vao tai khoan Airtime (su dung thoai va sms). Hieu luc su dung tai khoan Airtime la 1400 phut, sau thoi gian nay tai khoan Airtime se bi thu hoi neu Quy khach khong su dung het. So tien da ung se duoc tru vao tai khoan chinh. Tu choi nhan tin nhan, soan TC A gui 1357. CSKH:18001091 (0d).",0,0,1,shortcode,Viễn thông,NONE,real,real_label_0,data/ground_truth/dataset_label_0_with_categories.csv,1277
phase1_01276,Goi cuoc D6V (6.000d/1 ngay) cua QK da gia han thanh cong. Uu dai (2GB/ngay + MyTV addon VTVcab. Het dung luong dung truy cap). HSD den 14:49 25/04/2025. Goi cuoc gia han tu dong. Kiem tra dung luong con lai soan DATAKM gui 888. CSKH: 18001091 (0d).,0,0,1,shortcode,Viễn thông,NONE,real,real_label_0,data/ground_truth/dataset_label_0_with_categories.csv,1278
phase1_01277,"[TB] Bộ Công an cảnh báo: Xuất hiện tình trạng tội phạm lợi dụng các hình ảnh, video của người dân được công khai trên không gian mạng để chỉnh sửa, cắt, ghép tạo nội dung nhạy cảm nhằm đe dọa, tống tiền. Khuyến cáo người dân: Cảnh giác khi nhận được các tin nhắn, cuộc gọi có nội dung như trên; Không chuyển tiền khi bị đe dọa; Khi phát hiện dấu hiệu bị lừa đảo, cưỡng đoạt tài sản cần nhanh chóng trình báo Cơ quan Công an nơi gần nhất và phản ánh qua ứng dụng VNeID.",0,0,0,brandname,Dịch vụ công thật,NONE,real,real_label_0,data/ground_truth/dataset_label_0_with_categories.csv,1279
phase1_01278,Quy khach co 525 MB su dung den 14:48 24/04/2025 tu VinaPhone. CSKH 18001091.,0,0,1,shortcode,Viễn thông,NONE,real,real_label_0,data/ground_truth/dataset_label_0_with_categories.csv,1280
phase1_01279,Quy khach co 1005 MB su dung den 14:48 24/04/2025 tu VinaPhone. CSKH 18001091.,0,0,1,shortcode,Viễn thông,NONE,real,real_label_0,data/ground_truth/dataset_label_0_with_categories.csv,1281
phase1_01280,Quy Khach dang su dung goi M0 - Dich vu Mobile Internet va co 0 MB dung luong data mien phi.,0,0,0,shortcode,Viễn thông,NONE,real,real_label_0,data/ground_truth/dataset_label_0_with_categories.csv,1282
phase1_01281,"QK da dang ky thanh cong goi cuoc D6V (6.000d/1 ngay. Uu dai 2GB/ngay + MyTV addon VTVcab. Het dung luong dung truy cap). Kiem tra dung luong Data, soan DATAKM gui 888. Goi cuoc duoc gia han tu dong. CSKH: 18001091(0d)",0,0,1,shortcode,Viễn thông,NONE,real,real_label_0,data/ground_truth/dataset_label_0_with_categories.csv,1283
phase1_01282,"Tai khoan cua Quy khach da duoc nap 10,000d tu 126921 vao 23/04/2025 14:48:02. Ma giao dich 2281036349. Chi tiet lien he CSKH 18001091 (0d). Tran trong cam on!",0,0,1,shortcode,Viễn thông,NONE,real,real_label_0,data/ground_truth/dataset_label_0_with_categories.csv,1284
phase1_01283,"Ban co the qua NAP DIEN THOAI MIEN PHI 10.000D trong MoMo, het han 30/4. Mo Vi > UU DAI > QUA CUA TOI dung ngay!",0,0,0,brandname,Khác,NONE,real,real_label_0,data/ground_truth/dataset_label_0_with_categories.csv,1285
phase1_01284,"[TB] Nhân dịp Ngày Sách và Văn hoá đọc Việt Nam lần IV (21/4/2025), Bộ VHTTDL kêu gọi các tổ chức, doanh nghiệp và bạn đọc cả nước cùng nhau lan toả tình yêu sách, để mỗi người dân là một đại sứ văn hoá đọc, mỗi gia đình, cộng đồng là một không gian văn hoá đọc, để cùng sách bước vào kỷ nguyên mới, kỷ nguyên vươn mình của dân tộc.",0,0,0,brandname,Dịch vụ công thật,NONE,real,real_label_0,data/ground_truth/dataset_label_0_with_categories.csv,1286
phase1_01285,"(TB) Có ngay ƯU ĐÃI 50% KHI NẠP TIỀN TRÊN MY VNPT! Dành cho Quý khách NẠP TIỀN bằng hình thức trực tiếp, DUY NHẤT qua ứng dụng https://my.vnpt.com.vn/adv/napdt trong HÔM NAY 20/4/2025. Khuyến mãi được sử dụng gọi và nhắn tin trong 15 ngày. CSKH:18001091 (0đ).",0,1,1,brandname,Viễn thông,NONE,real,real_label_0,data/ground_truth/dataset_label_0_with_categories.csv,1287
phase1_01286,"(TB) Đặt lịch NẠP THẺ ƯU ĐÃI 50%! Duy nhất 20/04/2025, My VNPT dành tặng bạn KHUYẾN MẠI 50% khi Nạp điện thoại VinaPhone cho thuê bao trả trước (khuyến mại sử dụng gọi/nhắn tin trong 15 ngày)! Áp dụng cho mọi mệnh giá, không giới hạn tại https://my.vnpt.com.vn/adv/napthe50. CSKH: 18001091 nhánh 3 (0đ). Trân trọng!",0,1,1,brandname,Viễn thông,NONE,real,real_label_0,data/ground_truth/dataset_label_0_with_categories.csv,1288
phase1_01287,(TB) Quý khách NHẬN NGAY ƯU ĐÃI 20% giá trị thẻ nạp vào NGÀY MAI 18/4/2025. Khuyến mại được sử dụng gọi/nhắn tin trong 15 ngày. Nhanh tay nạp thẻ tại: https://my.vnpt.com.vn/adv/napthe để có thêm ưu đãi . CSKH:18001091 (0đ).,0,1,1,brandname,Viễn thông,NONE,real,real_label_0,data/ground_truth/dataset_label_0_with_categories.csv,1289
phase1_01288,(TB) CUỐI TUẦN RỘN RÀNG - NGÀY VÀNG NẠP THẺ! VinaPhone dành tặng Quý khách 20% giá trị thẻ nạp vào NGÀY MAI – 11/4/2025. Khuyến mãi được sử dụng gọi/nhắn tin các mạng trong 15 ngày. Nhanh tay nạp thẻ tại: https://my.vnpt.com.vn/adv/napthe để có thêm ưu đãi. CSKH: 18001091 (0đ).,0,1,1,brandname,Viễn thông,NONE,real,real_label_0,data/ground_truth/dataset_label_0_with_categories.csv,1290
phase1_01289,"(TB) KHAI HỘI GIỖ TỔ - NẠP THẺ BÙNG NỔ! My VNPT dành tặng bạn ƯU ĐÃI 50% khi Nạp điện thoại VinaPhone cho thuê bao trả trước (khuyến mại được sử dụng gọi/nhắn tin trong 15 ngày) ngày 06/04/2025. Áp dụng cho mọi mệnh giá, không giới hạn tại https://my.vnpt.com.vn/adv/napthe50. CSKH: 18001091 nhánh 3 (0đ). Trân trọng!",0,1,1,brandname,Viễn thông,NONE,real,real_label_0,data/ground_truth/dataset_label_0_with_categories.csv,1291
phase1_01290,"(TB) Đặt lịch nhận SIÊU ƯU ĐÃI NẠP THẺ! Duy nhất 06/04/2025, My VNPT tặng bạn KHUYẾN MẠI 50% khi Nạp điện thoại VinaPhone cho thuê bao trả trước (khuyến mại sử dụng gọi/nhắn tin trong 15 ngày)! Áp dụng cho mọi mệnh giá, không giới hạn tại https://my.vnpt.com.vn/adv/napthe50. CSKH: 18001091 nhánh 3 (0đ). Trân trọng!",0,1,1,brandname,Viễn thông,NONE,real,real_label_0,data/ground_truth/dataset_label_0_with_categories.csv,1292
phase1_01291,"(TB): VNPT Đồng Nai_Ưu đãi dành riêng cho Quý khách khi đăng ký gói Data ngày, soạn tin: D7 gửi 888 (có ngay 1,2GB/ngày, giá 7,000đ) hoặc D2 gửi 888 (có ngay 2GB/ngày, giá 10,000đ) của Vinaphone; Quý khách tham khảo thêm các gói cước khác tại Website: https://digishop.vnpt.vn. TC gửi 024800126 để từ chối.",0,1,0,brandname,Quảng cáo hợp lệ,NONE,real,real_label_0,data/ground_truth/dataset_label_0_with_categories.csv,1293
phase1_01292,Mã bảo mật Discord của bạn là: 349424   tzD9jY28Wrn,0,0,0,brandname,Cá nhân & OTP,NONE,real,real_label_0,data/ground_truth/dataset_label_0_with_categories.csv,1294
phase1_01293,Mã bảo mật Discord của bạn là: 657379   tzD9jY28Wrn,0,0,0,brandname,Cá nhân & OTP,NONE,real,real_label_0,data/ground_truth/dataset_label_0_with_categories.csv,1295
phase1_01294,"Ban co 10.000D qua Nap Dien Thoai & 140.000D qua khac trong MoMo, het han 31/3. Mo Vi > UU DAI > QUA CUA TOI dung ngay!",0,0,0,brandname,Khác,NONE,real,real_label_0,data/ground_truth/dataset_label_0_with_categories.csv,1296
phase1_01295,(TB) CƠ HỘI CUỐI - NẠP THẺ VINAPHONE LỜI 50%. Duy nhất hôm nay trên My VNPT tặng bạn ƯU ĐÃI 50% nạp điện thoại trực tiếp cho thuê bao trả trước (khuyến mại sử dụng gọi/nhắn tin trong 15 ngày). Đừng lỡ Chủ Nhật Vàng cuối cùng tháng 3! Nạp ngay https://my.vnpt.com.vn/adv/napthe50. CSKH: 18001091 nhánh 3 (0đ). Trân trọng!,0,1,1,brandname,Viễn thông,NONE,real,real_label_0,data/ground_truth/dataset_label_0_with_categories.csv,1297
phase1_01296,(TB) BẤT NGỜ CUỐI TUẦN! VinaPhone tặng Quý khách 50% khi nạp tiền DUY NHẤT bằng hình thức trực tiếp trên ứng dụng My VNPT (tại: https://my.vnpt.com.vn/adv/napdt ) trong hôm nay 23/03/2025. Khuyến mãi được sử dụng gọi và nhắn tin trong 15 ngày. CSKH:18001091 (0đ).,0,1,1,brandname,Viễn thông,NONE,real,real_label_0,data/ground_truth/dataset_label_0_with_categories.csv,1298
phase1_01297,"(TB) Đừng bỏ lỡ ưu đãi NẠP THẺ VinaPhone 50% cuối cùng tháng 3! My VNPT tặng bạn KHUYẾN MẠI 50% nạp điện thoại trực tiếp cho thuê bao trả trước (khuyến mại sử dụng gọi/nhắn tin trong 15 ngày). Duy nhất 23/03/2025 trên My VNPT, đặt lịch tại https://my.vnpt.com.vn/adv/napthe50. CSKH: 18001091 nhánh 3 (0đ). Trân trọng!",0,1,1,brandname,Viễn thông,NONE,real,real_label_0,data/ground_truth/dataset_label_0_with_categories.csv,1299
phase1_01298,"(TB) Cuối tuần này VinaPhone có quà! Vào ngày mai 21/03/2025, mời Quý khách nạp thẻ và nhận quà tặng 20% giá trị thẻ nạp (khuyến mại được sử dụng gọi/nhắn tin trong 15 ngày). Thêm ưu đãi khi nạp tại: https://my.vnpt.com.vn/adv/napthe . CSKH: 18001091 (0đ).",0,1,1,brandname,Viễn thông,NONE,real,real_label_0,data/ground_truth/dataset_label_0_with_categories.csv,1300
phase1_01299,"Truong DH CNTT thong bao hoc bu mon Cong nghe Java(IE303.P21) vao thu 6 ngay 28/03/2025, Tiet 1,2,3,4, Phong C314. Chi tiet vui long lien he (028) 372 52002 chon 155",0,0,0,brandname,Khác,NONE,real,real_label_0,data/ground_truth/dataset_label_0_with_categories.csv,1301
phase1_01300,Truong DH CNTT thong bao nghi hoc Mon Cong nghe Java(IE303.P21) vao thu 3 ngay 18 thang 03 nam 2025. Chi tiet vui long lien he (028) 372 52002 chon 155,0,0,0,brandname,Khác,NONE,real,real_label_0,data/ground_truth/dataset_label_0_with_categories.csv,1302
phase1_01301,"(TB) ỨNG DỤNG HAY - CÓ NGAY 50% KHI NẠP TIỀN! Duy nhất HÔM NAY - 16/03/2025, Quý khách nhận ngay quà tặng 50% khi nạp tiền qua ứng dụng My VNPT tại: https://my.vnpt.com.vn/adv/napdt . Khuyến mãi được sử dụng gọi và nhắn tin trong 15 ngày. CSKH:18001091 (0đ).",0,1,1,brandname,Viễn thông,NONE,real,real_label_0,data/ground_truth/dataset_label_0_with_categories.csv,1303
phase1_01302,"(TB) CHỦ NHẬT VÀNG - NẠP NGẬP TRÀN! My VNPT dành tặng bạn ƯU ĐÃI 50% khi Nạp điện thoại VinaPhone cho thuê bao trả trước (khuyến mại được sử dụng gọi/nhắn tin trong 15 ngày) ngày 16/03/2025. Áp dụng cho mọi mệnh giá, không giới hạn tại https://my.vnpt.com.vn/adv/napthe50. CSKH: 18001091 nhánh 3 (0đ). Trân trọng!",0,1,1,brandname,Viễn thông,NONE,real,real_label_0,data/ground_truth/dataset_label_0_with_categories.csv,1304
phase1_01303,"(TB) Đặt lịch nhận SIÊU ƯU ĐÃI, duy nhất 16/03/2025, My VNPT dành tặng bạn KHUYẾN MẠI 50% khi Nạp điện thoại VinaPhone cho thuê bao trả trước (khuyến mại sử dụng gọi/nhắn tin trong 15 ngày)! Áp dụng cho mọi mệnh giá, không giới hạn tại https://my.vnpt.com.vn/adv/napthe50. CSKH: 18001091 nhánh 3 (0đ). Trân trọng!",0,1,1,brandname,Viễn thông,NONE,real,real_label_0,data/ground_truth/dataset_label_0_with_categories.csv,1305
phase1_01304,"(TB) Cuối tuần nạp ngay, quà đầy tay! VinaPhone tặng Quý khách: + 20% giá trị thẻ nạp vào NGÀY MAI 14/03/2025 (khuyến mại được sử dụng gọi/nhắn tin trong 15 ngày).  + Nhanh tay nạp thẻ tại: https://my.vnpt.com.vn/adv/napthe để có thêm ưu đãi . CSKH:18001091 (0đ).",0,1,1,brandname,Viễn thông,NONE,real,real_label_0,data/ground_truth/dataset_label_0_with_categories.csv,1306
phase1_01305,"Truong DH CNTT thong bao hoc bu mon Nhap mon bao dam va an ninh thong tin(IE105.P22.1) vao thu 7 ngay 15/03/2025, Tiet 1,2,3,4,5, Phong B2.16. Chi tiet vui long lien he (028) 372 52002 chon 155",0,0,0,brandname,Khác,NONE,real,real_label_0,data/ground_truth/dataset_label_0_with_categories.csv,1307
phase1_01306,"Truong DH CNTT thong bao hoc HT2 mon Nhap mon bao dam va an ninh thong tin(IE105.P22.1) vao thu 7 ngay 15/03/2025, Tiet 1,2,3,4,5, Phong B1.04. Chi tiet vui long lien he (028) 372 52002 chon 155",0,0,0,brandname,Khác,NONE,real,real_label_0,data/ground_truth/dataset_label_0_with_categories.csv,1308
phase1_01307,(TB) Chớp thời cơ liền tay – Ghi điểm ngay với phái đẹp!  VinaPhone dành tặng Quý khách 20% giá trị thẻ nạp vào NGÀY MAI – 08/03/2025 để trao những lời yêu thương nhất nhân ngày Quốc tế Phụ nữ (khuyến mãi được sử dụng gọi/nhắn tin các mạng trong 15 ngày). Nhanh tay nạp thẻ tại: https://my.vnpt.com.vn/adv/napthe  để có thêm ưu đãi. CSKH: 18001091 (0đ),0,1,1,brandname,Viễn thông,NONE,real,real_label_0,data/ground_truth/dataset_label_0_with_categories.csv,1309
phase1_01308,Your verification code is 063318 Thank you,0,0,0,brandname,Cá nhân & OTP,NONE,real,real_label_0,data/ground_truth/dataset_label_0_with_categories.csv,1310
phase1_01309,Truong DH CNTT thong bao nghi hoc Mon Cong nghe Du lieu lon(IE212.P22.1) vao thu 5 ngay 06 thang 03 nam 2025. Chi tiet vui long lien he (028) 372 52002 chon 155,0,0,0,brandname,Khác,NONE,real,real_label_0,data/ground_truth/dataset_label_0_with_categories.csv,1311
phase1_01310,Your verification code is 844889 Thank you,0,0,0,brandname,Cá nhân & OTP,NONE,real,real_label_0,data/ground_truth/dataset_label_0_with_categories.csv,1312
phase1_01311,"(TB) Tháng mới DEAL tới, My VNPT dành tặng bạn ưu đãi HOÀN 50% tối đa 50.000đ/lần khi đăng ký gói cước di động cho chính mình trên ứng dụng My VNPT. Mỗi khách hàng nhận tối đa 3 lần ưu đãi/tháng, áp dụng đến hết 30/04/2025. Chi tiết tại https://my.vnpt.com.vn/adv/cashback50. CSKH 18001091 (0đ). Trân trọng!",0,1,1,brandname,Viễn thông,NONE,real,real_label_0,data/ground_truth/dataset_label_0_with_categories.csv,1313
phase1_01312,"QK da huy goi D6V thanh cong. De dang ky lai goi cuoc, vui long soan tin DK D6V gui 888 hoac lien he tong dai CSKH: 18001091 (0d). Tran trong!",0,0,1,shortcode,Viễn thông,NONE,real,real_label_0,data/ground_truth/dataset_label_0_with_categories.csv,1314
phase1_01313,"Yeu cau Huy goi D6V khong thanh cong do goi cuoc van con 1.79GB. De xac nhan huy het uu dai con lai trong goi va huy goi, QK soan HUY D6V Y gui 888. CSKH: 18001091 (0d). Tran trong!",0,0,1,shortcode,Viễn thông,NONE,real,real_label_0,data/ground_truth/dataset_label_0_with_categories.csv,1315
phase1_01314,Truong DH CNTT thong bao nghi hoc Mon Cong nghe Du lieu lon(IE212.P22) vao thu 5 ngay 06 thang 03 nam 2025. Chi tiet vui long lien he (028) 372 52002 chon 155,0,0,0,brandname,Khác,NONE,real,real_label_0,data/ground_truth/dataset_label_0_with_categories.csv,1316
phase1_01315,QuaTangVIP - Ma OTP cua ban la 172515. Ma co hieu luc trong vong 2 phut. Vui long khong chia se ma nay voi nguoi khac.,0,0,0,brandname,Cá nhân & OTP,NONE,real,real_label_0,data/ground_truth/dataset_label_0_with_categories.csv,1317
phase1_01316,Tai khoan chinh cua Quy khach sap het. Xin vui long nap the de tiep tuc su dung cac dich vu cua VinaPhone.,0,0,0,shortcode,Viễn thông,NONE,real,real_label_0,data/ground_truth/dataset_label_0_with_categories.csv,1318
phase1_01317,"[UNG TIEN AIRTIME] Tai khoan chinh cua Quy khach sap het. Soan A gui 1357 de duoc ung 15000d, GIA CUOC 0 DONG vao tai khoan Airtime (su dung thoai va sms). Hieu luc su dung tai khoan Airtime la 750 phut, sau thoi gian nay tai khoan Airtime se bi thu hoi neu Quy khach khong su dung het. So tien da ung se duoc tru vao tai khoan chinh. Tu choi nhan tin nhan, soan TC A gui 1357. CSKH:18001091 (0d).",0,0,1,shortcode,Viễn thông,NONE,real,real_label_0,data/ground_truth/dataset_label_0_with_categories.csv,1319
phase1_01318,CellphoneS: Ma OTP cua ban la 4331. Ma co hieu luc trong 3 phut. Vui long khong chia se ma nay voi bat ky ai.,0,0,0,brandname,Cá nhân & OTP,NONE,real,real_label_0,data/ground_truth/dataset_label_0_with_categories.csv,1320
phase1_01319,"Tai khoan cua Quy khach da duoc nap 10,000 dong tu MoMo -ung dung thanh toan hang dau Viet Nam - vao 23/02/2025 20:22:11. Ma giao dich 2245456131. CSKH 18001091 (0d). Tran trong cam on!",0,0,1,shortcode,Ngân hàng thật,NONE,real,real_label_0,data/ground_truth/dataset_label_0_with_categories.csv,1321
phase1_01320,"Ban co 10.000D qua Nap Dien Thoai & 140.000D qua khac trong MoMo, het han 28/2. Mo Vi > UU DAI > QUA CUA TOI dung ngay!",0,0,0,brandname,Khác,NONE,real,real_label_0,data/ground_truth/dataset_label_0_with_categories.csv,1322
phase1_01321,"Ban co the qua NAP DIEN THOAI MIEN PHI 10.000D trong MoMo, het han 28/2. Mo Vi > UU DAI > QUA CUA TOI dung ngay!",0,0,0,brandname,Khác,NONE,real,real_label_0,data/ground_truth/dataset_label_0_with_categories.csv,1323
phase1_01322,(TB) Cuối tuần vui vẻ- Nạp thẻ nhận quà! VinaPhone tặng Quý khách: + 20% giá trị thẻ nạp vào NGÀY MAI 21/02/2025 (khuyến mại được sử dụng gọi/nhắn tin trong 15 ngày).  + Thêm ưu đãi hời khi nạp thẻ tại https://my.vnpt.com.vn/adv/napthe .  CSKH:18001091 (0đ).,0,1,1,brandname,Viễn thông,NONE,real,real_label_0,data/ground_truth/dataset_label_0_with_categories.csv,1324
phase1_01323,"(TB) MUA DATA - LƯỚT MẠNG THẢ GA! My VNPT dành tặng bạn ưu đãi HOÀN 50% tối đa 50.000đ/lần khi đăng ký gói cước di động cho chính mình trên ứng dụng My VNPT. Mỗi khách hàng nhận tối đa 3 lần ưu đãi/tháng, áp dụng từ 17/02 - 30/04/2025. Chi tiết tại https://my.vnpt.com.vn/adv/cashback50. CSKH 18001091 (0đ). Trân trọng!",0,1,1,brandname,Viễn thông,NONE,real,real_label_0,data/ground_truth/dataset_label_0_with_categories.csv,1325
phase1_01324,"[UNG TIEN]Tai khoan chinh cua Quy Khach khong du de thuc hien cuoc goi/gui tin nhan. De duoc ung 8000d vao tai khoan chinh va tiep tuc su dung cac dich vu cua VinaPhone, Quy Khach vui long soan Y gui 1576 (hieu luc trong vong 48h) (Gia cuoc 1750d). De duoc ung tien tu dong khi tai khoan chinh duoi 5000d, soan UTD gui 1576. De tu choi nhan tin, Quy Khach vui long soan TC gui 1576",0,0,0,shortcode,Viễn thông,NONE,real,real_label_0,data/ground_truth/dataset_label_0_with_categories.csv,1326
